site,title,price,url,image,categories,description,availability
Velvety,Lily Linen Dress In Burgundy,210.00,https://velvety.com.au/products/pre-order-burgundy-lily-linen-dress,https://cdn.shopify.com/s/files/1/0273/0305/1400/products/PRE-ORDER-Lily-Linen-Dress-In-Burgundy-Nich-1664766356.jpg?v=1664766358,Dresses,"Sustainable Linen Dress The Lily dress is perfect for a busy day at the office keeping you cool and calm even on your most stressful days. Whatever occasion, whatever mood, this sustainably sourced dress is embedded with natural fibers to keep you feeling comfortable and looking beautiful. Linen dress handmade from sustainable linen fabric. This dress is made of 100% linen and has pockets. Available sizes: XS, S, M, L, XL, XXL. Need a larger size? Select XXL and add your measurements for bust/waist/hips as a note at the cart step before the checkout. The model is wearing an S size. This garment is true to size, we recommend choosing the size you usually wear. 100% linen. Medium weight (185g). The fabrics used are EAC certified. Measurement Tips: It is a European-made garment and sizing may differ from the Australian standard, so please, before ordering, measure your body with a measuring tape and follow the next directions. Bust: With your arms down, measure around the fullest part of your bust. Waist: Measure around your waistline keeping the measuring tape comfortably, not too tight. Hips: Measure around the fullest part of your hips (approximately 9 inches or 22cm down from waist). Model height (burgundy dress): 5`4” (166 cm) Model measurements: bust - 34”, waist - 27”, hips - 38” HOW TO CARE Handwashing is recommended Do not bleach. Machine wash 30º hot. Iron at maximum 200º. Dry normal, no heat. Brand: Nich",In stock
Velvety,Jemima Pant In Black Linen by Wilga Clothing,210.00,https://velvety.com.au/products/jemima-pant-in-black-linen,https://cdn.shopify.com/s/files/1/0273/0305/1400/products/Jemima-Pant-In-Black-Linen-by-Wilga-Clothing-Wilga-Clothing-1667379665.jpg?v=1667379667,Pants & Shorts,"SUSTAINABLE PANTS The Jemima Pant hugs the waist then flares loosely from the hip, featuring a zip and single button closure at the back, and Seventies-inspired patch pockets at the front. Drapey and wide-leg, finishing at the ankle to suit wedges, sandals, and boots. Material: linen-cotton weave for a natural look and feel, in black. Designed and ethically made in Melbourne, Australia. Brand: Wilga Clothing",In stock
Velvety,Sally Skirt In Linen Black by Wilga Clothing,175.00,https://velvety.com.au/products/sally-skirt-in-linen-black,https://cdn.shopify.com/s/files/1/0273/0305/1400/products/Sally-Skirt-In-Linen-Black-by-Wilga-Clothing-Wilga-Clothing-1666145868.jpg?v=1666145869,Skirts,"Sustainable Fashion Skirt The Sally Skirt features a zip and single button closure at the back, and Sixties-inspired patch pockets at the front. Material: linen cotton weave for a natural look and feel, in black. Designed and ethically made in Melbourne, Australia. Brand: Wilga Clothing",In stock
Velvety,ORGANIC DENIM ELWOOD SKINNY INDIGO by Keeper Denim,199.00,https://velvety.com.au/products/organic-denim-elwood-skinny-indigo,https://cdn.shopify.com/s/files/1/0273/0305/1400/products/ORGANIC-DENIM-ELWOOD-SKINNY-INDIGO--by-Keeper-Denim-Keeper-Denim-1664789407.jpg?v=1664789408,Pants & Shorts,"ORGANIC COTTON DENIM The Elwood Skinny in indigo colours is a high-rise, full-length jean where each and every detail has been considered. With the perfect amount of stretch, it comes in at the smallest part of your waist and elongates your legs, creating a timeless silhouette that is sure to become your next wardrobe staple. Both, the dark and the light indigo denim have been lightly faded by a sustainable manual brushing technique, minimizing our impact on the environment. These jeans are also accredited by Ethical Clothing Australia – ensuring all the workers in our supply chain are paid fairly, receive all their legal entitlements, and have safe working conditions and PETA-Approved Vegan – certifying that they are made without the use of any animal products This jean was handcrafted by denim artisans in a facility located in Melbourne that is certified by Ethical Clothing Australia (ECA), this ensures their workers are paid fairly, receive all their legal entitlements and have safe working conditions. Size The Elwood Skinny jean is true to size, so we recommend selecting the size you would normally wear in jeans. The model is 175cm / 5’9’’ tall and wears a size 8. Inseam length: 76cm / 30’’ Denim Composition 92% Organic Cotton 6% Recycled Polyester 2% Elastane Vegan brand patch: Jacron, made from cellulose. Brand: Keeper Denim",In stock
Velvety,Mama & Bub Gift Set by The Physic Garden,59.95,https://velvety.com.au/products/mama-bub-gift-set-by-the-physic-garden,https://cdn.shopify.com/s/files/1/0273/0305/1400/products/Mama-_-Bub-Gift-Set-by-The-Physic-Garden-The-Physic-Garden-1668395577.jpg?v=1668395579,Body Care,"VEGAN GIFT BOX Having a new baby is a big adjustment for Mum, recovering from pregnancy, new exhausting sleep patterns, breastfeeding, getting to know what baby likes (and doesn't like!). And everyone is so excited to see the baby, but who's taking care of Mum? So we thought we'd come up with something for the Mamas. Our Mama & Bub Gift Box has been designed to ease the transition for new Mamas, offering a thoughtful collection of things to nurture, uplift, and make her feel loved. We've included our Nursing Balm to help support the adjustment to breastfeeding and prevent sore, cracked skin. Belly Balm to help moisturize and soothe stretching bellies before and after the baby arrives. Baby Balm is a completely natural solution for baby skin and will help to prevent nappy rash and other skin irritations for bubs. Our Glow Bath Soak relaxes and restores, with uplifting Lemon Myrtle, Calendula & Magnesium salts. Everything in this gift set is Natural, Australian Made, Certified Cruelty-free & Vegan. Makes the perfect, uniquely curated baby shower gift for the New Mama in your life. ﻿Ethically Made using quality ingredients from organic, sustainable, and fair-trade sources wherever possible. Handmade with love in small batches in Melbourne Australia, so we can assure quality and freshness. Brand: The Physic Garden",Out of stock
Velvety,PRE-ORDER Vegan Chelsea Riot cactus leather boots by Bohema,369.00,https://velvety.com.au/products/pre-order-chelsea-riot-cactus-leather-boots,https://cdn.shopify.com/s/files/1/0273/0305/1400/products/PRE-ORDER-Vegan-Chelsea-Riot-cactus-leather-boots-by-Bohema-Bohema-1668328730.jpg?v=1668328731,Vegan Boots,"VEGAN BOOTS PRE-ORDER | Please allow up to 15-20 days of delivery from the date of purchase. In most cases, it will arrive prior to the 20 days period. Click here for more info. Chelsea Riot cactus platform boots are a must-have not only this season - sustainable fashion in street style. Shoes made by hand in Poland. Desserto® vegan cactus leather shoes. The inside of the shoe is finished with a material, breathable mesh. Sole made of high-quality rubber* Vegan shoes - all components are 100% vegan. Available sizes: EU 36-41 Sole height: 4 cm heel and 2 cm toe Black colour Please check your size in the size chart. We always recommend measuring your feet for a good fit and selecting your size by cm/inch. Brand: Bohema",In stock
Velvety,PRE-ORDER Vegan Cyber Boots Black cactus leather ankle boots by Bohema,289.00,https://velvety.com.au/products/pre-order-cyber-boots-black-cactus-leather-ankle-boots,https://cdn.shopify.com/s/files/1/0273/0305/1400/products/PRE-ORDER-Vegan-Cyber-Boots-Black-cactus-leather-ankle-boots-by-Bohema-Bohema-1668328742.jpg?v=1668328743,Vegan Boots,"VEGAN BOOTS PRE-ORDER | Please allow up to 15- 20 days of delivery from the date of purchase. In most cases, it will arrive prior to the 20 days period. Click here for more info. These ankle boots with a futuristic design made of innovative plant material are the perfect choice for those who appreciate style. Shoes made by hand in Poland. Desserto® cactus leather ankle boots. The inside of the shoe is finished with a material, breathable mesh. Sole made of high-quality rubber * Vegan shoes - all components are 100% vegan. Available sizes: EU 36-41 Sole height: 3.5 cm Black colour Zipper: Silver Please check your size in the size chart. We always recommend measuring your feet for a good fit and selecting your size by cm/inch. Brand: Bohema",In stock
Velvety,PRE-ORDER Vegan Swan No.1 Black Nopal cactus leather boots by Bohema,279.00,https://velvety.com.au/products/pre-order-swan-no-1-black-nopal-cactus-leather-boots,https://cdn.shopify.com/s/files/1/0273/0305/1400/products/PRE-ORDER-Vegan-Swan-No.1-Black-Nopal-cactus-leather-boots-by-Bohema-Bohema-1668328751.jpg?v=1668328752,Vegan Boots,"VEGAN BOOTS PRE-ORDER | Please allow up to 15-20 days of delivery from the date of purchase. In most cases, it will arrive prior to the 20 days period. Click here for more info. Ankle boots with a pointed toe on a geometric heel - A classic style! Shoes made by hand in Poland. Boots made of cactus leather Desserto® The inside of the shoe is made of lightweight mesh fabric. The shoes are finished with a YKK zipper and webbing with a brand logo. The shoe sole is made of recyclable rubber * Vegan shoes - all components are 100% vegan. Available sizes: EU 36-41 * Heel height: 5 cm Black colour Please check your size in the size chart. We always recommend measuring your feet for a good fit and selecting your size by cm/inch. Brand: Bohema",In stock
Velvety,PRE-ORDER Vegan Cyber Boots white cactus leather ankle boots by Bohema,289.00,https://velvety.com.au/products/pre-order-cyber-boots-white-cactus-leather-ankle-boots,https://cdn.shopify.com/s/files/1/0273/0305/1400/products/PRE-ORDER-Vegan-Cyber-Boots-white-cactus-leather-ankle-boots-by-Bohema-Bohema-1668328762.jpg?v=1668328763,Vegan Boots,"VEGAN BOOTS PRE-ORDER | Please allow up to 15- 20 days of delivery from the date of purchase. In most cases, it will arrive prior to the 20 days period. Click here for more info. These ankle boots with a futuristic design made of innovative plant material are the perfect choice for those who appreciate style. Shoes made by hand in Poland. Desserto® cactus leather ankle boots. The inside of the shoe is finished with a material, breathable mesh. Sole made of high-quality rubber * Vegan shoes - all components are 100% vegan. Available sizes: EU 36-41 Sole height: 3.5 cm White colour Zipper: Black Please check your size in the size chart. We always recommend measuring your feet for a good fit and selecting your size by cm/inch. Brand: Bohema",In stock
Velvety,PRE-ORDER Vegan Swan No.1 White Nopal cactus leather boots by Bohema,279.00,https://velvety.com.au/products/pre-order-swan-no-1-white-nopal-cactus-leather-boots,https://cdn.shopify.com/s/files/1/0273/0305/1400/products/PRE-ORDER-Vegan-Swan-No.1-White-Nopal-cactus-leather-boots-by-Bohema-Bohema-1668328776.jpg?v=1668328777,Vegan Boots,"VEGAN BOOTS PRE-ORDER | Please allow up to 15-20 days of delivery from the date of purchase. In most cases, it will arrive prior to the 20 days period. Click here for more info. Ankle boots with a pointed toe on a geometric heel - A classic style! Shoes made by hand in Poland. Boots made of cactus leather Desserto® The inside of the shoe is made of lightweight mesh fabric. The shoes are finished with a YKK zipper and webbing with a brand logo. The shoe sole is made of recyclable rubber * Vegan shoes - all components are 100% vegan. Available sizes: EU 36-41 * Heel height: 5 cm White colour Please check your size in the size chart. We always recommend measuring your feet for a good fit and selecting your size by cm/inch. Brand: Bohema",In stock
Velvety,PRE-ORDER Vegan Chelsea Black Vegea Boots by Bohema,279.00,https://velvety.com.au/products/pre-order-chelsea-black-vegea-boots,https://cdn.shopify.com/s/files/1/0273/0305/1400/products/PRE-ORDER-Vegan-Chelsea-Black-Vegea-Boots-by-Bohema-Bohema-1668328804.jpg?v=1668328806,Vegan Boots,"VEGAN BOOTS PRE-ORDER | Please allow up to 15-20 days of delivery from the date of purchase. In most cases, it will arrive prior to the 20 days period . Click here for more info. Dressed in grape leather, say Hi to our timeless style Chelsea boots. Shoes made by hand in Poland. Vegan boots made of grape leather Vegea. The inside of the shoe is finished with a material, breathable mesh. Sole made of high-quality rubber * Vegan shoes - all components are 100% vegan. Available sizes: EU 36-41 Heel height: 2 cm Black colour Please check your size in the size chart. Brand: Bohema",In stock
Velvety,PRE-ORDER Vegan Chunky Black Grape Leather Loafers by Bohema,259.00,https://velvety.com.au/products/pre-order-chunky-loafers-black-grape-leather-loafers,https://cdn.shopify.com/s/files/1/0273/0305/1400/products/PRE-ORDER-Vegan-Chunky-Black-Grape-Leather-Loafers-by-Bohema-Bohema-1668328881.jpg?v=1668328883,Flat Shoes,"VEGAN FLATS PRE-ORDER | Please allow up to 15-20 days of delivery from the date of purchase. In most cases, it will arrive prior to the 20 days period. Click here for more info. Take the classic style to the next level. Massive moccasins to emphasize your individual style. Shoes made by hand in Poland. Shoes made of leather made of Vegea® grapes The inside of the shoe is made of breathable fabric and apple leather. The shoe sole is made of recyclable rubber * Vegan shoes - all components are 100% vegan Available sizes: EU 36-41 Sole height: 3 cm Black colour Please check your size in the size chart. We always recommend measuring your feet for a good fit and selecting your size by cm/inch. Brand: Bohema",In stock
Velvety,PRE-ORDER Vegan Chunky Loafers White Grape Leather Loafers by Bohema,259.00,https://velvety.com.au/products/pre-order-chunky-loafers-white-grape-leather-loafers,https://cdn.shopify.com/s/files/1/0273/0305/1400/products/PRE-ORDER-Vegan-Chunky-Loafers-White-Grape-Leather-Loafers-by-Bohema-Bohema-1668328903.jpg?v=1668328905,Flat Shoes,"VEGAN FLATS PRE-ORDER | Please allow up to 15-20 days of delivery from the date of purchase. In most cases, it will arrive prior to the 20 days period. Click here for more info. Take the classic style to the next level. Massive moccasins to emphasize your individual style. Shoes made by hand in Poland. Shoes made of leather made of Vegea® grapes The inside of the shoe is made of breathable fabric and apple leather. The shoe sole is made of recyclable rubber * Vegan shoes - all components are 100% vegan Available sizes: EU 36-41 Sole height: 3 cm Black white Please check your size in the size chart. We always recommend measuring your feet for a good fit and selecting your size by cm/inch. Brand: Bohema",In stock
Velvety,Vegan Pumps Black ballerinas made of Pinatex by Bohema,99.00,https://velvety.com.au/products/pre-order-pumps-black-pina-ballerinas-made-of-pinatex,https://cdn.shopify.com/s/files/1/0273/0305/1400/products/PRE-ORDER-Vegan-Pumps-Black-ballerinas-made-of-Pinatex-by-Bohema-Bohema-1665118930.jpg?v=1665118931,Flat Shoes,"VEGAN FLATS The cult ballerinas in a plant version are perfect for your everyday! Shoes made by hand in Poland. Made of leather from Pinatex® pineapple leaves. The inside of the shoe is made of breathable fabric and apple leather. The shoe sole is made of recyclable rubber. Vegan shoes - all components are 100% vegan. Available sizes: EU 36-41 Heel height: 1 cm Black colour Please check your size in the size chart. Shoes are oversized, for example, if you are size 37 EU, you might need to choose size 36 EU. However, we always recommend measuring your feet for a good fit and selecting your size by cm/inch. Brand: Bohema",In stock
Velvety,Roll On Oils by New Moon Blends 10ml,20.00,https://velvety.com.au/products/roll-on-oils-by-new-moon-blends,https://cdn.shopify.com/s/files/1/0273/0305/1400/products/Roll-On-Oils-by-New-Moon-Blends-10ml-New-Moon-Blends-1668297155.jpg?v=1668297157,Body Care,"ESSENTIAL OILS Available in 3 combinations: PALO SANTO For the lovers of palo santo and those who want to wear it all day long - we have created a blend with earthy, woody, and sweet scents. This holy wood will help enhance and connect with your higher consciousness. Ingredients: Coconut fractionated oil Palo Santo oil Vetivers Cinnamon Vanilla ECLIPSE SEASON We have created eclipse season for support during the total lunar eclipse on May 29th and solar eclipse in Gemini on June 10th. Eclipse usually brings us to a different gateway and can change our lives dramatically. Eclipse Season is a magical time for transformation and this oil will support you in this journey. Ingredients: Coconut fractionated oil. Jasmine - enhances eclipse season, reduces stress and cleanses the aura & raises vibrations. Sandalwood - for grounding, calming and balance emotions. Mandarin - It unlocks creative energies and great for new beginnings. Marjoram - reduces stress and creates optimism in achieving goals and creating the new. MERCURY GATORADE We have created mercury retrograde oil to enhance communication during this chaotic time and to create a peaceful and grounding atmosphere - infused with tourmaline for protection. Ingredients: Coconut fractionated oil. Lemongrass - helps promote concentration. Neroli - Compassionate communication and to enhance an uplifting atmosphere. Clary sage - helps promote clarity and calmness when miscommunication arises. Cedarwood - helps promote clarity and calmness when miscommunication arises. Chamomile - helps soothe and calm emotions. Directions: A pply to your temples, forehead, wrists, chest, or soles of the feet or in your alter during any rituals. Handmade in Australia. Brand: New Moon Blends",In stock
Velvety,PRE-ORDER Vegan Grapes Leather Ritzy Slides by Bohema,199.00,https://velvety.com.au/products/pre-order-grapes-leather-ritzy-slides,https://cdn.shopify.com/s/files/1/0273/0305/1400/products/PRE-ORDER-Vegan-Grapes-Leather-Ritzy-Slides-by-Bohema-Bohema-1668328968.jpg?v=1668328970,Sandals,"VEGAN FLAT SANDALS PRE-ORDER | Please allow up to 15- 20 days of delivery from the date of purchase. In most cases, it will arrive prior to the 20 days period. Click here for more info. Ritzy Slides are such a chic option for warm days - you could wear them with flowy skirts, linen garments, or cropped jeans. They are the definition of summer chic. Shoes made by hand in Poland. Vegea® grape leather slides shoes. Sole made of high-quality rubber. The insert is made of natural cork coated with apple leather. Vegan shoes - all components are 100% vegan. Available sizes: EU 36-41 * Sole height: 1,5 cm Colours: Black or White Please check your size in the size chart. We always recommend measuring your feet for a good fit and selecting your size by cm/inch. Brand: Bohema",In stock
Velvety,PRE-ORDER Vegan Grapes Leather Geigi Flatforms Sandals by Bohema,229.00,https://velvety.com.au/products/pre-order-grapes-leather-geigi-flatforms-sandals,https://cdn.shopify.com/s/files/1/0273/0305/1400/products/PRE-ORDER-Vegan-Grapes-Leather-Geigi-Flatforms-Sandals-by-Bohema-Bohema-1668328984.jpg?v=1668328986,Sandals,"VEGAN SANDALS PRE-ORDER | Please allow up to 15- 20 days of delivery from the date of purchase. In most cases, it will arrive prior to the 20 days period. Click here for more info. These cork flatforms are the perfect shoes for many summers. They will spice up every stylization and they will not go out of fashion quickly. Your comfort in a stylish way for any occasion. Shoes made by hand in Poland. Vegea® grape leather slides shoes. The inside of the shoe is finished with apple vegetable leather. Natural cork sole, reinforced with rubber * Vegan shoes - all components are 100% vegan. Available sizes: EU 36-41 * Sole height: 5 cm Colours: Black Please check your size in the size chart. We always recommend measuring your feet for a good fit and selecting your size by cm/inch. Brand: Bohema",In stock
Velvety,PRE-ORDER Vegan Uptown White Nopal cactus leather sandals by Bohema,199.00,https://velvety.com.au/products/pre-order-uptown-white-nopal-cactus-leather-sandals,https://cdn.shopify.com/s/files/1/0273/0305/1400/products/PRE-ORDER-Vegan-Uptown-White-Nopal-cactus-leather-sandals-by-Bohema-Bohema-1668329072.jpg?v=1668329074,Sandals,"VEGAN SANDALS PRE-ORDER | Please allow up to 15-20 days of delivery from the date of purchase. In most cases, it will arrive prior to the 20 days period. Click here for more info. These stylish sandals built on geometric heels are a must-have for every minimalist. Shoes made by hand in Poland. Made of cactus leather Desserto®. The inside of the shoe is made of apple leather. The shoe sole is made of recyclable rubber. Vegan shoes - all components are 100% vegan. Available sizes: EU 36-41 * Heel height: 5 cm White colour Please check your size in the size chart. We always recommend measuring your feet for a good fit and selecting your size by cm/inch. Brand: Bohema",In stock
Velvety,PRE-ORDER Vegan Uptown Black Nopal cactus leather sandals by Bohema,199.00,https://velvety.com.au/products/pre-order-uptown-black-nopal-cactus-leather-sandals,https://cdn.shopify.com/s/files/1/0273/0305/1400/products/PRE-ORDER-Vegan-Uptown-Black-Nopal-cactus-leather-sandals-by-Bohema-Bohema-1668329083.jpg?v=1668329085,Sandals,"VEGAN SANDALS PRE-ORDER | Please allow up to 15-20 days of delivery from the date of purchase. In most cases, it will arrive prior to the 20 days period. Click here for more info. These stylish sandals built on geometric heels are a must-have for every minimalist. Shoes made by hand in Poland. Made of cactus leather Desserto®. The inside of the shoe is made of apple leather. The shoe sole is made of recyclable rubber. Vegan shoes - all components are 100% vegan. Available sizes: EU 36-41 * Heel height: 5 cm Black colour Please check your size in the size chart. We always recommend measuring your feet for a good fit and selecting your size by cm/inch. Brand: Bohema ♡ STYLE ME WITH...",In stock
Velvety,PRE-ORDER Vegan No. 3 Boots made of cactus leather by Bohema,289.00,https://velvety.com.au/products/pre-order-no-3-boots-made-of-desserto-cactus-leather,https://cdn.shopify.com/s/files/1/0273/0305/1400/products/PRE-ORDER-Vegan-No.-3-Boots-made-of-cactus-leather-by-Bohema-Bohema-1668328824.jpg?v=1668328825,Vegan Boots,"VEGAN BOOTS PRE-ORDER | Please allow up to 15- 20 days of delivery from the date of purchase. In most cases, it will arrive prior to the 20 days period. Click here for more info. Classic Worker Boots style made of cactus leather on a raised and reinforced sole. Perfect for all seasons! Shoes made by hand in Poland. Desserto® cactus leather ankle boots. The inside of the shoe is finished with a material, breathable mesh. The shoe sole is made of EVA foam. Vegan shoes - all components are 100% vegan. Available sizes: EU 36-41 Sole height: 2.5 cm Black colour Please check your size in the size chart. We always recommend measuring your feet for a good fit and selecting your size by cm/inch. Brand: Bohema",In stock
Velvety,Unisex Vegan Black Cork Braided Belt by Artelusa,39.00,https://velvety.com.au/products/unisex-black-cork-braided-belt,https://cdn.shopify.com/s/files/1/0273/0305/1400/products/Unisex-Vegan-Black-Cork-Braided-Belt-by-Artelusa-Artelusa-1667988538.jpg?v=1667988540,Belts,"Cork Belt Cruelty-Free & Vegan Cork belt for men and women Colour: Black Size: 90/95/100/105/110/115 cm ( please note: the length of this belt is measured without (the buckle + flat cork extension part which measures 15cm). For example: if you are after a belt that has a total length of 115cm you will order 100cm). Eco-Friendly & Free of Harmful Chemicals High-Quality Italian Hardware Lighter, Softer & More Durable Than Leather Waterproof, Stain-Resistant & Easy to Clean Care instructions: Cork fabric is waterproof so you can clean your bag with a clean cloth and a little bit of liquid soap and some water. Remove any excess soap with a damp cloth and allow the item to dry naturally. Brand: Artelusa",Out of stock
Velvety,Unisex Natural Cork Braided Belt by Artelusa,39.00,https://velvety.com.au/products/unisex-natural-cork-braided-belt,https://cdn.shopify.com/s/files/1/0273/0305/1400/products/Unisex-Natural-Cork-Braided-Belt-by-Artelusa-Artelusa-1668392073.jpg?v=1668392075,Belts,"Cork Belt Cruelty-Free & Vegan Cork belt for men and women (40MM) Colour: Natural Size: 90/95/100/105/110/115 cm ( please note: the length of this belt is measured without (the buckle + flat cork extension part which measures 15cm). For example: if you are after a belt that has a total length of 115cm you will order 100cm). Eco-Friendly & Free of Harmful Chemicals High-Quality Italian Hardware Lighter, Softer & More Durable Than Leather Waterproof, Stain-Resistant & Easy to Clean Care instructions: Cork fabric is waterproof so you can clean your bag with a clean cloth and a little bit of liquid soap and some water. Remove any excess soap with a damp cloth and allow the item to dry naturally. Brand: Artelusa",In stock
Velvety,Cork ceramic green water bracelet by Artelusa,29.00,https://velvety.com.au/products/cork-ceramic-green-water-bracelet,https://cdn.shopify.com/s/files/1/0273/0305/1400/products/Cork-ceramic-green-water-bracelet-by-Artelusa-Artelusa-1668342993.jpg?v=1668342995,Jewellery,"Cork Jewelry Cruelty-Free & Vegan Cork leather with ceramic bits Eco-Friendly & Free of Harmful Chemicals High-Quality Italian Hardware Lighter, Softer & More Durable Than Leather Waterproof, Stain-Resistant & Easy to Clean Peta Approved Vegan Brand: Artelusa Care instructions: Cork fabric is waterproof so you can clean your bag with a clean cloth and a little bit of liquid soap and some water. Remove any excess soap with a damp cloth and allow the item to dry naturally.",In stock
