site,title,price,url,image,categories,description,availability
Little Eco Shop,Ecyo - Eco-friendly Dishwasher Tablets,15.95,https://littleecoshop.com.au/products/ecyo-eco-friendly-dishwasher-tablets,https://cdn.shopify.com/s/files/1/0031/7344/9797/products/Ecyo-dishwasher-tablets-sml.jpg?v=1657769388,,"Ecyo’s eco-friendly dishwashing tablets sure do pack a punch! With activated charcoal, Ecyo's dishwashing tablets naturally target tough stains to leave your dishes (and your conscience) clean. Each tablet contains added rinse aid action and protects against limescale to leave your machine running smoothly. Simply place one tablet into the dispensing draw and select the appropriate wash cycle. The soluble and biodegradable wrapping will dissolve during the wash cycle. Why have we selected this product? Eco-friendly tablets with no nasty chemicals Pack of 30 Grey water and septic tank safe Strong and effective cleaning power Plant based Packaging made of recycled and compostable cardboard Palm oil free Vegan and cruelty free Glass protection, stainless steel protection, filter protection, limescale protection, starch removal, rinse free shine, tea stain removal, removes encrusted food Product Stats: Material: Dimensions / weight: 30 tablets per box, 450g Made in: China (Developed in Australia) Ingredients: <25% Sodium Carbonate, <15% Oxygen based bleaching agent, <5% Protease, Charcoal, <1% Amylase, Orange oil.",In stock
Little Eco Shop,Baby Quoddle - Replacement Medium Teat & Cap,14.95,https://littleecoshop.com.au/products/baby-quoddle-replacement-medium-teat,https://cdn.shopify.com/s/files/1/0031/7344/9797/products/IMG_E6414_00e14a0c-4ac4-488f-a1c8-b953a4b555b1.jpg?v=1655424329,Food Pouches,These replacement medium flow teats made of pure natural rubber are interchangeable with the 150ml & 300ml bottles so you can get the most out of your glass baby bottles. Why have we selected this product? Plastic-free Toxin-free Interchangeable with the 150ml & 300ml bottles Natural rubber teats & covers Each pack comes with one replacement teat and cap Product Stats: Material: Natural rubber Dimensions / weight: Medium flow Made in: Designed by an Aussie mum. CAUTION: Please note these bottles are glass nursing bottles and need direct supervision at all times. Each bottle has a negative pressure release valve. Whilst feeding baby please ensure this is clear of babies mouth (position clear and to the side). CARE: It is most import that the rubber teats and cap be cared for as per instructions. The rubber is all natural and cannot be exposed to heat. The teats should be washed in soapy water and then can be placed in Milton solution for the required time and removed from solution and stored in a container somewhere cool. They should never be left in solution for long period or rubber will get damaged.,In stock
Little Eco Shop,Planet Revive – Medium Cold & Heat Bags (various patterns),36.00,https://littleecoshop.com.au/products/planet-revive-medium-heat-bags,https://cdn.shopify.com/s/files/1/0031/7344/9797/products/Planet_Revive_Heat_bag_Medium_7b5e1e3b-8f45-4213-849e-e5b68f25e874.jpg?v=1656386142,,"Soothe sore muscles or keep warm and cosy this winter with our stunning handmade heat bags. Our heat packs are a little different to others because they contain Lupin (a legume grown right here in Queensland) instead of wheat, barley, rice or even plastic. Lupin is a great alternative because it is odourless when heated unlike traditional heat bags which develop a 'cooked' or 'burnt' smell over time. Lupins also retain their heat for longer, they are lighter than wheat and they don't sweat when heated. To use, simply pop in the microwave and heat for 1 - 1.5 minutes. Heat for a further 30 seconds at a time thereafter to avoid overheating. Durations may vary from machine to machine so please be exercise caution. Why have we selected this product? Contains Lupin which is odourless, retains heat longer, lighter and doesn’t sweat Lupin sourced locally Handmade right here in Queensland Thoughtfully designed with a removable outer cover for easy cleaning (cold machine washable) Can also be used as a cool pack – simply pop in a ziplock bag and place in the freezer and use to ice injuries or cool yourself down on hot summer days Child-friendly patterns Product Stats: Material: Cotton outer, Lupin contents Dimensions / weight: 30 x 15cm, 1kg Made in: Australia PLEASE NOTE: if Lupins are overheated they will develop of slight smell (similar to popcorn!) which is difficult to remove. Please therefore start by heating for a smaller amount of time and adding more time, if required.",In stock
Little Eco Shop,Planet Revive – Large Cold & Heat Bags (various patterns),38.00,https://littleecoshop.com.au/products/planet-revive-large-heat-bags,https://cdn.shopify.com/s/files/1/0031/7344/9797/products/Planet_Revive_Heat_bag_Large_8813c6fe-ad06-4bdb-b44c-fd858d0ca109.jpg?v=1656386332,,"Soothe sore muscles or keep warm and cosy this winter with our stunning handmade heat bags. Our heat packs are a little different to others because they contain Lupin (a legume grown right here in Queensland) instead of wheat, barley, rice or even plastic. Lupin is a great alternative because it is odourless when heated unlike traditional heat bags which develop a 'cooked' or 'burnt' smell over time. Lupins also retain their heat for longer, they are lighter than wheat and they don't sweat when heated. To use, simply pop in the microwave and heat for 1.5 - 2 minutes. Heat for a further 30 seconds at a time thereafter to avoid overheating. Durations may vary from machine to machine so please be exercise caution. Why have we selected this product? Contains Lupin which is odourless, retains heat longer, lighter and doesn’t sweat Lupin sourced locally Handmade right here in Queensland Thoughtfully designed with a removable outer cover for easy cleaning (cold machine washable) Can also be used as a cool pack – simply pop in a ziplock bag and place in the freezer and use to ice injuries or cool yourself down on hot summer days Product Stats: Material: Cotton outer, Lupin contents Dimensions / weight: 35 x 17cm, 1kg Made in: Australia PLEASE NOTE: if Lupins are overheated they will develop of slight smell (similar to popcorn!) which is difficult to remove. Please therefore start by heating for a smaller amount of time and adding more time, if required.",In stock
Little Eco Shop,Lil’ Bit Better - Merino Wool Dryer Balls,22.95,https://littleecoshop.com.au/products/lil-bit-better-merino-wool-dryer-balls,https://cdn.shopify.com/s/files/1/0031/7344/9797/products/Lil-Bit-better-merino-wool-dryer-balls.jpg?v=1655256652,Soap Nuts,"Everybody knows that air drying our clothes is the more eco-friendly option but sometimes we have no choice but to use the dryer. These 100% New Zealand Merino Wool Dryer Balls are a must-have for those occasions as they help to dry your laundry quicker, reduce your power bill, and they help eliminate static and wrinkles from your clothes. All you need to do is pop all six balls into your dryer with your wet laundry and off you go. Just be mindful not to overload the dryer as this will cause the wool balls to absorb moisture and prohibit them from creating air pockets for better circulation. To remove any surface lint or fluff, give them a quick tumble on their own. Why have we selected this product? Reduces drying time (and therefore your power bill) Reduces pesky static Reduces wrinkles (and therefore ironing time) Each ball will last over 1000 dryer loads (which equates to approximately 5 years of use, based on 4 loads per week). Each pack contains 6 100% New Zealand Merino Wool Balls Plastic-free packaging Product Stats: Material: 6 x 100% New Zealand Merino Wool Balls Dimensions / weight: ~5cm diameter Made in: New Zealand",In stock
Little Eco Shop,The Little Veggie Patch Co. Grow Food Anywhere Book,48.00,https://littleecoshop.com.au/products/the-little-veggie-patch-co-grow-food-anywhere-book,https://cdn.shopify.com/s/files/1/0031/7344/9797/files/Grow-Food-Anywhere-new.png?v=1733220363,Reading,"NEW 2024 Edition (new cover). Grow Food Anywhere is the Little Veggie Patch Co’s fifth book and really does redefine what it means to grow food in small spaces. This book looks at the modern styles of gardening that makes it possible for any aspiring, small space, time poor person to grow their own edible paradise. New systems such as wicking beds, aquaponics and hydroponics are covered, as are more traditional styles of raised garden beds, in-ground planting, and of course, planting in pots. There are three distinct chapters within the book: What Plants Need (Soil, Light and Water; Infrastructure; Planting and Harvesting styles) Fruit and Veg to Grow (more than 70 varieties of fruit and vegetable across all the climatic zones in Australia and NZ; a completely new design makes interpreting the plant maintenance and watering an ease) Pest and Disease to Know (25 Pest and Disease; identifying them according to their appearance and damage they cause, and then how to cope, treat and eradicate them organically) Why have we selected this product? A guide to growing food regardless of the size of your patch Includes information about when to plant seeds specific to your region Great gift idea for any outdoor or garden loving family Product Stats: Material: Dimensions / weight: 28 x 22 cm Made in: Printed in China",In stock
Little Eco Shop,Ecyo - Kitchen Degreaser Cleaning Pods (for spray bottles) 3 pack,12.95,https://littleecoshop.com.au/products/ecyo-kitchen-degreaser-cleaning-pods-for-spray-bottles-3-pack,https://cdn.shopify.com/s/files/1/0031/7344/9797/products/Ecyo_degreaser.png?v=1653891399,,"Ecyo’s eco-friendly cleaning pods are not only an innovative alternative to unsustainable supermarket bought cleaners but they’re also really effective and efficient cleaners. This lemon and lime kitchen degreaser is great at removing grime off stovetops and will leave surfaces sparkling clean while removing grease with ease. The highly concentrated cleaning pods fully dissolve in water so you can completely avoid single use plastic cleaning bottles while also avoiding the harsh chemicals. Using the kitchen degreaser spray pods is easy – simply add warm water to an old repurposed spray bottle (or you can purchase a reusable amber bottle here), drop the pod inside the bottle, swirl a few times and watch it dissolve. Then top up with cold water and clean a multitude of surfaces such as appliances, splash backs, kitchen cupboards and kitchen countertops. Each pod can create up to 750ml of cleaning solution or you can use less water for a more concentrated cleaner. 500ml is a good volume to start with and you can experiment from there. Why have we selected this product? Dissolvable pods replace plastic bottles of cleaning solutions Considerably reduce the amount of plastic and harsh chemicals in your home Pack of 3 Lovely lemon and lime scent Each pack contains a label which can be added to your bottle at home. Grey water and septic tank safe Each pod creates up to 750mls of cleaning solution Strong and effective cleaning power No nasty chemicals Plant based Reduced carbon footprint as you don't need to ship water around the world Packaging made of recycled and compostable material Palm oil and phosphate-free Product Stats: Material: Dimensions / weight: 3 pods, each creates up to 750ml Made in: China (Developed in Australia) Ingredients: Non-ionic plant-based surfactants (cleaning agent) Less than 1% Phenoxyethanol (preservative) Naturally derived fragrance (lemon and lime). Note from manufacturer: these pods are designed to dissolve when they come into contact with water therefore it's important they are stored in a dry place away from splashing water. Storing in a sealed Tupperware is a great idea. D o not touch the pods with wet hands.",In stock
Little Eco Shop,ZeroCare Sacred Water Dry Shampoo,39.95,https://littleecoshop.com.au/products/zerocare-sacred-water-dry-shampoo,https://cdn.shopify.com/s/files/1/0031/7344/9797/products/Zerocare_plastic-free-dry_shampoo_blonde.jpg?v=1652757971,,"Introducing Zerocare’s new low-tox hair styling and dry shampoo powder. This Sacred Water Dry Shampoo powder comes packaged in a handy cardboard tube which is 100% home compostable at the end of its life. This means no more disposable aerosol cans or plastic containers which typically use hydrocarbons as propellants. Simply use this toxin-free and zero waste powder to uplift and refresh your hair by sprinkling the Blonde Australian Sandalwood and Geranium infused powder or Light Brunette Cacao & Peppermint infused powder onto the roots of your hair 1-2 times per week (or as required). The 3-in-1 soothing antibacterial formula has been created to rebalance excess oil, enhance volume, while also nourishing the scalp. The Deep Brunette powder also works wonders at disguising premature greys and concealing bald spots. Why have we selected this product? Rebalances excess oil, enhances volume and nourishes the scalp Saves water Ocean safe formula Plastic-free Home compostable packaging (with plant based inks) Vegan and cruelty free Made of toxin-free, plant based ingredients Lightweight formula Made in Australia Three colours available Blonde formula best suited to blonde and light brown hair Light Brunette formula best suited to light to dark brown hair Deep Brunette formula best suited to dark brown to black hair Product Stats: Material: contains Australian Sandalwood and Geranium essential oils Dimensions / weight: 30g tube Made in: Australia",In stock
Little Eco Shop,Minimal Essentials – Laundry Stain Removing Sticks,7.95,https://littleecoshop.com.au/products/minimal-essentials-laundry-stain-removing-sticks,https://cdn.shopify.com/s/files/1/0031/7344/9797/products/Minimal-essentials-stain-remover-stick.jpg?v=1647488183,,"These incredibly powerful and effective solid stain removing sticks provide a superb alternative to typical store bought stain removers. Not only are they plastic-free but they’re also natural with don’t contain any nasty or toxic ingredients. They contain Australian Lemon Myrtle, a natural antimicrobial and D-Limonene which is a highly effective cleaning agent derived from citrus. To use, wet the stained fabric and the stain remover stick with cold water and then rub the stick onto the stain vigorously. Rinse [and repeat if required] and watch as the stain completely disappears before your eyes! Apply to stain as soon as possible. It can also be used as a pre-wash treatment on discoloured collars and stubborn areas. Why have we selected this product? Palm Oil free Powerful natural ingredients Beautiful lemon myrtle scent Plastic-free Replaces plastic bottled stain removers Quick and easy to use Australian made 100% vegan & cruelty-free Product Stats: Ingredients: Saponified Coconut Oil (Sodium Cocoate), Citrus Oil (D-Limonene), Australian Lemon Myrtle Oil (Backhousia Citriodora) Dimensions / weight: 2 sticks, 30g each Made in: Australia",In stock
Little Eco Shop,The Naked Soap Company - Menthol Chest Rub,10.95,https://littleecoshop.com.au/products/the-naked-soap-company-menthol-chest-rub,https://cdn.shopify.com/s/files/1/0031/7344/9797/products/Menthol-chest-rub.jpg?v=1646874946,,"The perfect natural and plastic-free alternative to store bought chest rubs. This menthol rub is lovingly made by hand by The Naked Soap Company and contains tea tree oil and menthol crystals to provide a powerful balm to help relieve blocked noses and stuffiness as a result of a cold or flu. Simply rub a small amount into your skin on your chest, particularly at bedtime. Why have we selected this product? Palm Oil free Preservative Free Natural Handmade with love Plastic-free glass jar Powerful and effective Product Stats: Material / Ingredients: Grapeseed Oil, Cocoa Butter, Mango Butter, Candelilla Wax, Menthol Crystals, Tea Tree Oil. Dimensions / weight: 20g Made in: Australia Please note: Do not use on face. For external use only. If irritation occurs discontinue use. This product contains no preservatives. Ensure you are using clean, dry hands to remove product from container and do not introduce water to the container. Pregnant women and small children should check with their doctor before use.",Out of stock
Little Eco Shop,"The Naked Soap Company - Magnesium, Lavender and Rosemary Bath Soak",18.50,https://littleecoshop.com.au/products/the-naked-soap-company-magnesium-lavender-and-rosemary-bath-soak,https://cdn.shopify.com/s/files/1/0031/7344/9797/products/Bath-soak-magnesium.jpg?v=1646874372,,"These luxury bath soaks by The Naked Soap Company are perfect for a little in-home self-care. Treat yourself or someone else to a gift of ultimate relaxation while also soothing your skin. This Lavender and Rosemary Soak contains magnesium chloride flakes (a more concentrated form of Epsom salts) which is reputed to reduce muscle soreness and swelling with fresh lavender and rosemary for a luxurious and fragrant experience. Why have we selected this product? Palm Oil free Preservative Free Natural Handmade with love Plastic-free - packaged in glass bottle Smells divine Luxurious and relaxing A lovely gift idea Product Stats: Material / Ingredients: Magnesium Flakes (Magnesium Chloride), Lavender Buds, Rosemary Springs, Lavender Essential Oil, Rosemary Essential Oil. Dimensions / weight: 250g Made in: Australia Scoop floating rose petals/rosemary stalks from the bath before draining to avoid plugging the drain.",In stock
Little Eco Shop,The Naked Soap Company - Goat's Milk Soap,10.95,https://littleecoshop.com.au/products/the-naked-soap-company-goats-milk-soap,https://cdn.shopify.com/s/files/1/0031/7344/9797/products/Goats-milk-soap.jpg?v=1646872887,,"The gentlest of soap bars is this Goat’s milk soap providing a moisturising and gentle cleanse for young children or those with sensitive skin. These divine soap bars by The Naked Soap Company are handmade in South Australia with the finest local ingredients. Local Olive Oil, Goat’s milk and gentle Shea Butter are combined for a nourishing, non-drying formula. Why have we selected this product? Palm Oil free Preservative Free Natural Handmade with love Plastic-free Smells divine Gentle and moisturising Product Stats: Material / Ingredients: Olive Oil, Coconut oil, Goats Milk, Sodium Hydroxide (none remains in the finished product), Shea Butter. Dimensions / weight: 90g Made in: Australia",In stock
Little Eco Shop,The Naked Soap Company - Scrub Soap Bar with Embedded Loofah,10.95,https://littleecoshop.com.au/products/the-naked-soap-company-scrub-soap-bar-with-embedded-loofah,https://cdn.shopify.com/s/files/1/0031/7344/9797/products/Scrub-bar-with-embedded-loofah.jpg?v=1646872395,,"If you’re looking for a luxury soap bar with a hidden exfoliator within then this is the bar for you! These divine soap bars by The Naked Soap Company are handmade in South Australia with the finest local ingredients. Local olive oil and gentle Shea Butter provide hydration for your skin while the natural embedded loofah inside the soap provides a deep skin scrub. The bars are coloured with Pink Clay and scented with lavender, grapefruit and citrus essential oils. Why have we selected this product? Vegan Palm Oil free Preservative Free Natural Handmade with love Plastic-free Smells divine Hydrating and exfoliating Product Stats: Material: Did you know loofah is a natural, compostable and eco-friendly sponge derived from the Luffa plant. Ingredients: Olive Oil, Coconut Oil, Water, Sodium Hydroxide (none remains in the finished product), Shea Butter, Loofah, Pink Clay, Lavender Essential Oil, Grapefruit Essential Oil, Lime Essential Oil, Lemon Essential Oil. Dimensions / weight: 70g Made in: Australia",In stock
Little Eco Shop,The Naked Soap Company - Orange & Poppy Seed Soap,10.95,https://littleecoshop.com.au/products/the-naked-soap-company-orange-poppy-seed-soap,https://cdn.shopify.com/s/files/1/0031/7344/9797/products/Orange-poppy-seed-soap-bar.jpg?v=1646871749,,"If you’re looking for a luxury soap bar that leaves your skin feeling exfoliated and hydrated all at the same time, then look no further. These divine soap bars by The Naked Soap Company are handmade in South Australia with the finest local ingredients. Local olive oil and gentle Shea Butter provide hydration for your skin while the natural Poppy seeds give a gentle exfoliation. Why have we selected this product? Vegan Palm Oil free Preservative Free Natural Handmade with love Plastic-free Smells divine Hydrating and exfoliating Product Stats: Material / Ingredients: Olive Oil, Coconut Oil, Water, Sodium Hydroxide (none remains in the finished product), Shea Butter, Poppy Seeds, Orange Essential Oil, Grapefruit Essential Oil, Annatto (Natural Colourant). Dimensions / weight: 85g Made in: Australia",Out of stock
Little Eco Shop,Ecyo - Recycled Amber Spray Bottle,6.00,https://littleecoshop.com.au/products/ecyo-recycled-amber-spray-bottle,https://cdn.shopify.com/s/files/1/0031/7344/9797/products/ecyo-multipurpose-cleaning-pods_96ab50f7-bffb-45ef-89fd-659a595270a3.jpg?v=1645748399,,"Using Ecyo's eco-friendly cleaning pods is easy – simply add warm water to an old repurposed spray bottle, drop the pod inside the bottle, swirl a few times and watch it dissolve. Then top up with cold water and clean to your heart's content. If you don't have access to an old spray bottle to repurpose, these amber spray bottles offer the perfect solution as they're made right here in Australia of recycled plastic. Simply attach the label provided with your Ecyo cleaning pods and away you go. Why have we selected this product? Made in Australia Made of recycled plastic BPA free Holds 500ml Designed to be reused Product Stats: Material: recycled plastic Dimensions / weight: 550ml Made in: Australia",In stock
Little Eco Shop,"Ecyo - Mixed Box of Bathroom, Window and Multipurpose Cleaning Pods (for spray bottles) 3 pack",12.95,https://littleecoshop.com.au/products/ecyo-mixed-box-of-bathroom-window-and-multipurpose-cleaning-pods-for-spray-bottles-3-pack,https://cdn.shopify.com/s/files/1/0031/7344/9797/products/Ecyo-mixed-box-cleaning-pods.jpg?v=1645748529,,"Ecyo’s eco-friendly cleaning pods are not only an innovative alternative to unsustainable supermarket bought cleaners but they’re also really effective and efficient cleaners. The highly concentrated cleaning pods fully dissolve in water so you can completely avoid single use plastic cleaning bottles while also avoiding the harsh chemicals. Now available in a mixed box so you can trial a few of Ecyo's most popular cleaners in one box: Multipurpose cleaner - (orange zest): ideal for cleaning: Kitchen benches, tables, tiles, white goods... Bathroom cleaner - (ocean breeze): the perfect option for cleaning the bath, shower, toilet and bathroom tiles. Window cleaner - (eucalyptus): will leave your windows and mirrors clean and streak free! Using the cleaning pods is easy – simply add warm water to an old repurposed spray bottle (or you can purchase a reusable amber bottle here), drop the pod inside the bottle, swirl a few times and watch it dissolve. Then top up with cold water and clean to your heart's content. Each pod can create up to 750ml of cleaning solution or you can use less water for a more concentrated cleaner. 500ml is a good volume to start with and you can experiment from there. Why have we selected this product? Dissolvable pods replace plastic bottles of cleaning solutions Considerably reduce the amount of plastic and harsh chemicals in your home Pack of 3 Each pack contains a label which can be added to your bottle at home. Grey water and septic tank safe Each pod creates up to 750mls of cleaning solution Strong and effective cleaning power No nasty chemicals Plant based Reduced carbon footprint as you don't need to ship water around the world Packaging made of recycled and compostable material Palm oil and phosphate-free Product Stats: Material: Dimensions / weight: 3 pods, each creates up to 750ml Made in: China (Developed in Australia) Note from manufacturer: these pods are designed to dissolve when they come into contact with water therefore it's important they are stored in a dry place away from splashing water. Storing in a sealed Tupperware is a great idea. D o not touch the pods with wet hands.",In stock
