site,title,price,url,image,categories,description,availability
Little Eco Shop,Georganics Compostable Dental Floss Refills,17.95,https://littleecoshop.com.au/products/georganics-compostable-dental-floss-refills,https://cdn.shopify.com/s/files/1/0031/7344/9797/products/Georganics_Corn_floss.jpg?v=1651225685,Floss,"Did you know traditional floss is typically made of nylon which is derived from crude oil and can take up to 80 years to break down? Why not switch to this fully compostable alternative by Georganics. This biodegradable dental floss is made from corn-based PLA, coated with vegetable wax and flavoured with organic Spearmint oil. Why have we selected this product? 2 x 50m refills Glass flint with a metal cap dispenser sold separately Home compostable Made from corn-based PLA, coated with vegetable wax and organic spearmint oil Zero waste product Vegan & cruelty-free Plastic free packaging Gluten free Product Stats: Material: Corn-based PLA, coated with Vegetable Wax and organic Spearmint Oil Dimensions / weight: Floss 2 x 50m long Made in: China PLEASE NOTE: corn starch floss is not as strong as traditional nylon floss so you may experience breakage if you have particularly tightly packed teeth.",In stock
Little Eco Shop,Retro Kitchen Dish Cloth - Bin Chickens,7.95,https://littleecoshop.com.au/products/retro-kitchen-dish-cloth-bin-chickens,https://cdn.shopify.com/s/files/1/0031/7344/9797/files/BinChickensdishcloth.png?v=1747191300,Dish Cloth,"These Retro Kitchen dish cloths feature unique and lighthearted designs making cleaning so much more fun! But best of all, they are plastic-free and are biodegradable and compostable at the end of their life meaning they can avoid going to landfill. Why have we selected this product? Come in a range of designs to suit all kitchens and personalities Biodegradable and compostable (just bury in your garden or put in composter at end of life) Plastic-free Machine washable Super absorbent With one slightly rough side and one smooth side they are ideal for washing dishes and for wiping surfaces Glide over surfaces easily leaving them streak-free Product Stats: Material: Cotton and cellulose Dimensions / weight:﻿ 20 cm x 18cm Made in: Sweden (designed in Australia)",In stock
Little Eco Shop,MiEco - Laundry Soap Nuts 250g,20.00,https://littleecoshop.com.au/products/mieco-laundry-soap-nuts-250g,https://cdn.shopify.com/s/files/1/0031/7344/9797/files/transgroupwithnutssml.png?v=1746661132,Soap Nuts,"Soap nuts or soap berries are derived from the fruit of a tree called 'Sapindus Mukorossi'. The tree fruits for 6 months of the year and continues to fruit for 90 years which makes it incredibly sustainable. The berries naturally contain Saponin which is a surfactant and can be used like soap and hence are used as a natural alternative to laundry detergent. Soap nuts are 100% natural and organic and can be composted after use. Simply add 4-5 soap nut shells to the reusable laundry bag provided and throw them straight in with your laundry. This same bag of nuts can be used ~5 times before they are composted in your back garden. Dry the shells between washes (or use again immediately if doing multiple loads of laundry). Why have we selected this product? 100% natural and organic No chemicals Safe for waterways Compostable after use (simply throw into flower bed) Economical – each 250g bag of soap nuts will last approximately 100 washes which equates to approx. 20c/wash Naturally anti-bacterial, anti-fungal and hypoallergenic therefore great for sensitive skin or those with skin conditions Soap nuts can be used to make a liquid concentrate (instructions are provided) and can be used as laundry liquid or in a spray bottle as a natural pest control for your vegetable patch or as a pet shampoo (simply apply to fur, massage in and rinse). Product Stats: Material: Soap nuts and unbleached, biodegradable calico bag Dimensions / weight: 250g Made in: Ethically sourced from India",In stock
Little Eco Shop,Brush It On Compostable Organic Silk Floss,9.95,https://littleecoshop.com.au/products/brush-it-on-compostable-organic-silk-floss,https://cdn.shopify.com/s/files/1/0031/7344/9797/files/silkfloss.png?v=1739328404,Floss,"Did you know traditional floss is typically made of nylon which is derived from crude oil and can take up to 80 years to break down? Why not switch to this natural, fully compostable alternative by Brush It On. This biodegradable dental floss is made from ethically sourced organic silk which has been coated in Candelilla wax and flavoured with mint. Why have we selected this product? Comes in a reusable glass flint with a metal cap which is completely plastic-free Home compostable Made using cruelty-free silk that is obtained only once the worms have hatched and the cocoons are vacant. It is made in a way that is more humane to silkworms than many traditional methods Zero waste product Plastic free Gluten free Product Stats: Material: Organic Silk, Euphorbia Cerifera Wax, Mentha Spicata Herb Oil Dimensions / weight: Floss 30m long. Flint 5.5cm tall Made in: China",Out of stock
Little Eco Shop,Rinse & Repeat Sherbet Bowl Cover Set (Duo),39.95,https://littleecoshop.com.au/products/rinse-repeat-sherbet-bowl-cover-set-duo,https://cdn.shopify.com/s/files/1/0031/7344/9797/files/Sherbet_Bowl_Covers.jpg?v=1741134889,Food Covers,"These stunning handmade reusable bowl covers beat disposable clingwrap any day of the week! Covering bowls sustainably, stylishly and conveniently has never been easier. Both bowl covers feature an elasticated edge so they fit snugly around bowls plus they have two layers; a beautiful cotton out layer that is easy on the eye and an easy-to-clean wipeable PUL lining. Reusable bowl covers are perfect for covering salads, your dough as it rises, food at meal-times, baking, leftovers, picnics, barbeques, pot-luck dinners, camping, al fresco dining, party food – essentially anything you want to keep flies, hands, and air off. Why have we selected this product? Comes in a set of 2 to accommodate most bowl sizes Various designs to choose from Food-safe PUL lining for added freshness Easy to clean wipeable PUL lining Machine washable (cold machine wash and line dry) Durable Reusable Handmade Easy to use – no more wrestling clingwrap Product Stats: Material: Cotton and PUL Dimensions / weight: XS 14-20cm, S 19-24cm Made in: Aotearoa, New Zealand",In stock
Little Eco Shop,Ecoegg – Laundry Egg Refill Pellets - Fresh Linen,19.95,https://littleecoshop.com.au/products/ecoegg-laundry-egg-refill-pellets-fresh-linen,https://cdn.shopify.com/s/files/1/0031/7344/9797/files/ecoegg-refill-pellets.png?v=1740108012,,"Refill your ecoegg after 50 washes. This refill box contains everything you need for one refill. Simply empty all the pellets into your ecoegg and continue washing your clothes with a clean conscience! The ecoegg is an innovative way to wash your clothes while using less chemicals and reducing plastic at the same time. The ecoegg Laundry Egg contains non biological, refillable laundry detergent and replaces fabric softener. There are two types of pellets included, which are placed inside the reusable egg – white washing pellets and black tourmaline pellets, which work together to clean your clothes. The surfactant molecules in our formula help water to take hold of the dirt and grease, break it up, and wash it away from your clothes. The black tourmaline pellets naturally ionise the water, making it slightly more alkaline. Alkaline water helps to lift dirt more effectively. Why have we selected this product? Free from parabens, phosphates, chlorine bleaches, enzymes, SLS/SLES Beautiful subtle fresh linen scent Dermatologically tested and hypoallergenic - ideal for sensitive skin Contains 2 x bags of white washing pellets & 1 x bag of black tourmaline pellets (enough for one refill) Quick and easy to use 100% vegan & cruelty-free Palm oil free 1 egg saves up to 40 plastic bottles per year Can be washed with water as low as 15C Refill pellets also available at Little Eco Shop Product Stats: Ingredients: per box Dimensions / weight: Made in: UK",Out of stock
Little Eco Shop,Ecoegg – Laundry Egg Starter Kit - Fresh Linen,29.95,https://littleecoshop.com.au/products/ecoegg-laundry-egg-starter-kit-fresh-linen,https://cdn.shopify.com/s/files/1/0031/7344/9797/files/ecoegg-box.png?v=1740106948,,"In the words of ecoegg ""be a good egg and use our sustainable, reusable laundry detergent eggs""! The ecoegg is an innovative way to wash your clothes while using less chemicals and reducing plastic at the same time. The ecoegg Laundry Egg contains non biological, refillable laundry detergent and replaces fabric softener. There are two types of pellets included, which are placed inside the reusable egg – white washing pellets and black tourmaline pellets, which work together to clean your clothes. The surfactant molecules in our formula help water to take hold of the dirt and grease, break it up, and wash it away from your clothes. The black tourmaline pellets naturally ionise the water, making it slightly more alkaline. Alkaline water helps to lift dirt more effectively. Simply pop your ecoegg Laundry Egg on top of your clothes and select your desired cycle. It's that easy! Refill your ecoegg after 50 washes with your refill detergent pellets, available here. Why have we selected this product? Free from parabens, phosphates, chlorine bleaches, enzymes, SLS/SLES Beautiful subtle fresh linen scent Dermatologically tested and hypoallergenic - ideal for sensitive skin Contains 1 x Laundry Egg case, 2 x bags of white washing pellets, 1 x bag of black tourmaline pellets and 2 x detox tablets (to detox your machine) Quick and easy to use 100% vegan & cruelty-free Palm oil free 1 egg saves up to 40 plastic bottles per year Can be washed with water as low as 15C Refill pellets also available at Little Eco Shop Product Stats: Ingredients: per box Dimensions / weight: Made in: UK",Out of stock
Little Eco Shop,Retro Kitchen Carry Your Cutlery - Aussie Animals,29.95,https://littleecoshop.com.au/products/retro-kitchen-carry-your-cutlery-aussie-animals,https://cdn.shopify.com/s/files/1/0031/7344/9797/files/Aussie_Animals_Cutlery.jpg?v=1739416058,Cutlery & Coconut Bowls,"Carry Your Cutlery by Retro Kitchen is an excellent eco-friendly and sustainable alternative to the plastic cutlery provided at cafes, bars and fast-food venues. They are easily transported in your bag, car or lunch bag so you can say no to single use plastic wherever you are. Why have we selected this product? Contains a knife, fork, spoon, chopsticks, straw and straw cleaning brush All items made of 18/10 stainless steel Comes packaged in a beautifully designed metal carry tin with hinged lid Calico pouch provided inside carry tin so you can keep dirty items separate from clean Product Stats: Material: 18/10 stainless steel Dimensions / weight: approx. 22cm x 5 cm Made in: China",In stock
Little Eco Shop,Retro Kitchen Dish Cloth - Colourful Dogs,7.95,https://littleecoshop.com.au/products/retro-kitchen-dish-cloth-colourful-dogs,https://cdn.shopify.com/s/files/1/0031/7344/9797/files/Colourful-Dogs-dish-cloth.jpg?v=1739415669,Dish Cloth,"These Retro Kitchen dish cloths feature unique and lighthearted designs making cleaning so much more fun! But best of all, they are plastic-free and are biodegradable and compostable at the end of their life meaning they can avoid going to landfill. Why have we selected this product? Come in a range of designs to suit all kitchens and personalities Biodegradable and compostable (just bury in your garden or put in composter at end of life) Plastic-free Machine washable Super absorbent Glide over surfaces easily leaving them streak-free Product Stats: Material: Cotton and cellulose Dimensions / weight:﻿ 20 cm x 18cm Made in: Sweden (designed in Australia)",In stock
Little Eco Shop,The Bare Living Co. The Only Paste and Scrub & Dish Set,14.95,https://littleecoshop.com.au/products/the-bare-living-co-the-only-paste-80g,https://cdn.shopify.com/s/files/1/0031/7344/9797/files/TheOnlyPasteScrubDish.jpg?v=1738639226,Dish Cloth,"Introducing The Only Paste you'll need!! This is a highly concentrated, long lasting, grime busting, multipurpose cleaning paste that you can use on most household surfaces. The beautifully scented eucalyptus cleaning paste by The Bare Living Co. is h ighly effective at cleaning most surfaces including glass, mirror, laminex, tile, grout, cooktops, ovens, BBQs, outdoor plastics and so many more! Why not combine it with a bamboo scrubbing brush and ceramic dish for a fully plastic-free clean! The Only Paste is handmade using biodegradable surfactants and coconut derived cleansers to give your home the most thorough clean with powerful grease busting properties. Instructions for use: Using a wet cloth, sponge or brush, scoop a small amount of paste out of the tin & lather up directly onto your pre-damped surface to be cleaned. You will learn over time how much you need but less is more when using The Only Paste! Gently scrub in circular motions & rinse the area when complete. It’s worth noting that The Only Paste doesn’t contain any of the synthetic foaming agents that traditional cleaners contains so it can take a small change in mindset to get used to fewer bubbles. But trust me when I say it still has amazing cleaning power. Why have we selected this product? Handmade in Australia Biodegradable surfactants Coconut derived cleansers Plastic-free container – reusable and recyclable aluminum tin Amazing grease busting powers Eucalyptus scent Highly effective at cleaning most surfaces including glass, mirror, laminex, tile, grout, cooktops, ovens, BBQs, outdoor plastics and so many more! Optional extra: bamboo scrubbing brush with white ceramic dish (for catching drips) Product Stats: Material: Coconut derived cleansers packaged in an aluminum container Dimensions / weight: 80g Made in: Australia PLEASE NOTE: Not suitable for those with coconut allergies",In stock
Little Eco Shop,Ever Eco Stainless Steel Mini Containers - Set Of 3 - Autumn Collection,24.95,https://littleecoshop.com.au/products/ever-eco-stainless-steel-mini-containers-set-of-3-autumn-collection,https://cdn.shopify.com/s/files/1/0031/7344/9797/files/Autumnminis.png?v=1736294797,Stainless Steel Lunchboxes,"Ever Eco stainless steel, round mini containers come in a set of 3 and are ideal for small snacks or dips and sauces inside your lunchbox or lunchbag. Top Tip: Use one of these mini containers for soy sauce and pop in inside the Ever Eco single compartment bento snack box to make a perfect takeaway sushi box. Why have we selected this product? Gorgeous autumn coloured lids (clay, honey, olive) Premium 304 food grade stainless steel which won’t retain or impart flavours Leak-proof silicone lids Containers fit perfectly inside Ever Eco Bento Boxes Containers are dishwasher safe Durable Reusable and recyclable Free from BPA, PVC, Lead and Phthalates Product Stats: Material: 304 food grade stainless steel and silicone lids Dimensions / weight: 60ml x 3 Made in: China",In stock
Little Eco Shop,EcoNaps Arcadia Cloth Nappy,34.95,https://littleecoshop.com.au/products/econaps-arcadia-cloth-nappy,https://cdn.shopify.com/s/files/1/0031/7344/9797/products/large_k4ew3mvRcSoXAmMiWcwb_Arcadia-Modern-Cloth-Nappy.jpg?v=1584932557,Cloth Nappies,"EcoNaps reusable modern cloth nappies offer stunning, unique prints that are hand designed in Byron Bay. This one size fits all nappy is adjustable in size so it will fit your bub from newborn (3.5kg) to toilet trained (16kg). This beautiful nappy is trim and convertible so it can be used as either an all-in-2 nappy or a pocket nappy. Why have we selected this product? Nappy includes convertible cloth nappy cover plus 2 bamboo inserts Choose to use as an All-in-2 nappy or a Pocket nappy One size fits all (from 3.5kg to 16kg), newborn to toilet training Economical – save money by avoiding disposable nappies Washable and reusable Healthy for your baby – no chemicals close to their skin Can be used as a night nappy (additional inserts may be required) Bamboo inserts offer superior absorbency and up to 5 different absorption settings (achieved through various folding combinations) PUL outer layer prevents any leaks Product Stats: Material: PUL outer lining with bamboo inserts Dimensions / weight: One size (fits 3.5kg to 16kg) Made in: China",Out of stock
Little Eco Shop,Selkia - Eco-friendly Back Scrubber,22.50,https://littleecoshop.com.au/products/eco-turtle-life-eco-back-scrubber,https://cdn.shopify.com/s/files/1/0031/7344/9797/files/Back-scrubber.jpg?v=1691970353,,"Made from natural materials this handy eco-friendly back scrubber is perfect for reaching those hard to reach areas while showering, without harming the environment. They're made from sustainably sourced bamboo fabric and organic natural loofah to provide a satisfying exfoliation. The generous 70cm length makes cleansing your back a effortless experience. To use, simply take one of the handles to flick over your back and grab the other handle with your free hand. Move up and down to wash and exfoliate your back. It can be used on legs as well. Why have we selected this product? Plastic-free Natural Ergonomic handles at either end Makes cleansing and exfoliating hard-to-reach areas effortless Product Stats: Material: bamboo fabric and organic loofah sponge Dimensions / weight: 70cm long Made in: China",In stock
Little Eco Shop,Lil’ Bit Better - Christmas Spice Room Spray 50ml,11.95,https://littleecoshop.com.au/products/lil-bit-better-christmas-spice-room-spray-50ml,https://cdn.shopify.com/s/files/1/0031/7344/9797/files/xmasroomspray.jpg?v=1730259509,,"This limited edition mini room spray is perfect for stocking stuffers, teachers gifts or as that extra Lil' add on! A blend of 100% Organic warm, spicy, and citrus essential oils to promote relaxation, mental focus and stress relief during the holiday season. The scent is reminiscent of gingerbread and as with all Lil' Bit Products, isn't sickly or overpowering. Why have we selected this product? Smells divine and reminds me of Christmas puddings and gingerbread! Comes in a rPET (recycled plastic) bottle which is made from 100% post-consumer (used/existing) recycled content making it both recyclable and reusable! Handmade in Australia Vegetable based inks used on label Recyclable lid and atomiser Wonderful stocking filler idea Product Stats: Material: ACO Organic Witch Hazel, ACO Organic Glycerol / Glycerine Solubilizer (Palm Oil Free), Demineralised Water, Organic Essential Oils including Sweet Orange, Cinnamon Bark, Cardamom, Nutmeg, Cinnamon Leaf and Clove Bud. Dimensions / weight: 50ml Made in: Australia",Out of stock
Little Eco Shop,Lil' Bit - Gardeners Gift Pack,50.00,https://littleecoshop.com.au/products/lil-bit-gardeners-gift-pack,https://cdn.shopify.com/s/files/1/0031/7344/9797/files/SmGardenpack.jpg?v=1730339070,,"A beautifully presented and mindfully curated gift pack for any green thumb in your life. This gift pack contains 500ml of Gardener's Soap, 250ml of Shoo! Insect Repellent and a muslin bag of six Bee Seed Bombs. All products are handmade here in Australia with natural ingredients so you can avoid toxic chemicals while helping encourage pollinators to your garden. The Activated Charcoal & Pumice Gardener's Soap by Lil' Bit is handmade with the best organic Activated Charcoal and finest Pumice, creating a slightly abrasive Castile based hand soap to neutralise odours and clean even the grubbiest of hands! It is infused with certified organic essential oils to leave hands feeling fresh, clean and soft. The Shoo! Insect repellent is a low-tox insect repellent that actually works. Now you can enjoy your BBQ's and outdoor activities this summer with this pleasant smelling, effective mosquito and fly repellent. A mix of woody, citrus and floral tones combined to make a summer perfume with a purpose! Made from all natural and organic ingredients, this spray is even safe enough to use on babies. Bee Seed Bombs are small balls of organic matter have been impregnated with a collection of herb and flower seeds which will flower year after year and will encourage pollinators to your garden. Simply throw the ball into your garden (and water) wherever you’d like to add a bit of life and colour. Why have we selected this product? Beautiful gift idea for any gardening or nature enthusiast Packaged in a cardboard gift bag & ribbon - ready to gift Pleasant natural fragrances Hand soap and inspect repellent comes in rPET (recycled plastic) bottles which is made from 100% post-consumer (used/existing) recycled content making it both recyclable and reusable while supporting a circular economy Handmade in Australia Product Stats: Material/Ingredients: See Gardener's Soap , Shoo! and Bee Seed Bombs Dimensions / weight: Made in: Handmade in Australia",In stock
Little Eco Shop,Gardening on Country - Recycled Plastic Kids Hand Trowel (Pink & Blue),12.95,https://littleecoshop.com.au/products/gardening-on-country-recycled-plastic-kids-hand-trowel-pink-blue,https://cdn.shopify.com/s/files/1/0031/7344/9797/files/IMG_5082.jpg?v=1727255340,Grow your own,"These wonderfully designed garden hand tools are now available in a kids size so the little loves in your life can get their hands dirty with you in the garden or build sandcastles at the beach. Not only strong, durable and ergonomic but they are made from recycled plastic lids which would have otherwise been destined for landfill. These petite hand trowels are available in both Ulysses Blue and Bumbunga Pink. Why have we selected this product? Each tool diverts 25 plastic lids from landfill Ergonomic design that's comfortable to use for small hands Durable and designed to last Lightweight with sturdy grip Perfect for the beach or garden Product Stats: Material: Recycled Plastic Dimensions / weight: 20cm and just 50g Made in: Australian",In stock
Little Eco Shop,Gardening on Country - Recycled Plastic Garden Hand Tools,39.95,https://littleecoshop.com.au/products/gardening-on-country-recycled-plastic-garden-hand-tools,https://cdn.shopify.com/s/files/1/0031/7344/9797/files/GOC_Content_Garden_6_4bbba6d3-2d7b-4aa7-9cbb-7bae5f8efebf.jpg?v=1727255230,Grow your own,"These wonderfully designed garden hand tools are not only strong, durable and ergonomic but they are made from recycled plastic lids which would have otherwise been destined for landfill. These two tools come as a pair and include a hand trowel and hand fork so you can get your garden tasks done quickly and easily. Why have we selected this product? Each tool diverts 75 plastic lids from landfill Ergonomic design that's comfortable to use Durable and designed to last Lightweight with sturdy grip This gardening duo includes as hand trowel and fork Product Stats: Material: Recycled Plastic Dimensions / weight: 30cm Made in: Australian",In stock
Little Eco Shop,Retro Kitchen Dish Cloth - Hearts,7.95,https://littleecoshop.com.au/products/retro-kitchen-dish-cloth-hearts,https://cdn.shopify.com/s/files/1/0031/7344/9797/files/RetroKitchencompostablekitchensponge_Hearts.jpg?v=1726708177,Dish Cloth,"These Retro Kitchen dish cloths feature unique and lighthearted designs making cleaning so much more fun! But best of all, they are plastic-free and are biodegradable and compostable at the end of their life meaning they can avoid going to landfill. Why have we selected this product? Come in a range of designs to suit all kitchens and personalities Biodegradable and compostable (just bury in your garden or put in composter at end of life) Plastic-free Machine washable Super absorbent Glide over surfaces easily leaving them streak-free Product Stats: Material: Cotton and cellulose Dimensions / weight:﻿ 20 cm x 18cm Made in: Sweden (designed in Australia)",In stock
Little Eco Shop,Retro Kitchen Dish Cloth - Chillies,7.95,https://littleecoshop.com.au/products/retro-kitchen-dish-cloth-chillies,https://cdn.shopify.com/s/files/1/0031/7344/9797/files/RetroKitchencompostablekitchensponge_Chillies.jpg?v=1726708061,Dish Cloth,"These Retro Kitchen dish cloths feature unique and lighthearted designs making cleaning so much more fun! But best of all, they are plastic-free and are biodegradable and compostable at the end of their life meaning they can avoid going to landfill. Why have we selected this product? Come in a range of designs to suit all kitchens and personalities Biodegradable and compostable (just bury in your garden or put in composter at end of life) Plastic-free Machine washable Super absorbent Glide over surfaces easily leaving them streak-free Product Stats: Material: Cotton and cellulose Dimensions / weight:﻿ 20 cm x 18cm Made in: Sweden (designed in Australia)",Out of stock
