site,title,price,url,image,categories,description,availability
Little Eco Shop,The Bare Living Co. Dish Paste – 80g,13.95,https://littleecoshop.com.au/products/the-bare-living-co-dish-paste-80g,https://cdn.shopify.com/s/files/1/0031/7344/9797/files/dish_paste_citrus3.jpg?v=1684114928,Dish Cloth,"Did you know you can hand wash your dishes 100% plastic-free? But what about the plastic dish washing liquid bottles, I hear you ask!? Introducing the beautifully scented citrus dish paste by The Bare Living Co. Combine this with one of our many plastic-free scourers/scrub pads/brushes or cloths and you've got yourself a completely plastic-free kitchen sink. This dish paste is handmade using biodegradable surfactants and coconut derived cleansers to give your dishes the most thorough clean with powerful grease busting properties. Instructions for use: Using a wet cloth, sponge or brush, scoop a small amount of paste out of the tin & lather up directly onto your pre-damped surface to be cleaned. You will learn over time how much you need but less is more when using this Dish Paste! Gently scrub in circular motions & rinse the area when complete. It’s worth noting that this dish paste doesn’t contain any of the synthetic foaming agents that traditional dish washing liquid contains so it can take a small change in mindset to get used to fewer bubbles. But trust me when I say it still has amazing cleaning power. Why have we selected this product? Handmade in Australia Biodegradable surfactants Coconut derived cleansers Plastic-free container – reusable and recyclable aluminum tin Amazing grease busting powers Highly effective at cleaning dishes Product Stats: Material: Coconut derived cleansers packaged in an aluminum container Dimensions / weight: 80g Made in: Australia PLEASE NOTE: Not suitable for those with coconut allergies",In stock
Little Eco Shop,Poppy & Daisy - Make Your Own Bag Tags,24.95,https://littleecoshop.com.au/products/poppy-and-daisy-make-your-own-bag-tags,https://cdn.shopify.com/s/files/1/0031/7344/9797/products/Mini-Eco-Bag-tags-10.jpg?v=1603450988,,"This wonderfully creative eco kit is designed to develop your little ones fine motor skills, creativity and sense of achievement. This mini eco kit includes enough beads and clips to make two fun bag tags so your little one can make one for themselves and one for their bestie to adorn their school or kindy bags! Why have we selected this product? Made by hand in Australia Made using environmentally friendly materials and packaging Each kit includes 2 x cords,2 x metal clips, wooden beads, 2 x wooden decorative discs, calico bag Creative play using natural, eco-conscious materials Perfect stocking filler and plastic-free gift Available in two colours – pastel colours and natural colours Product Stats: Material: Various but all made using environmentally materials Dimensions / weight: Made in: Handmade in Australia PLEASE NOTE: These kits are not suitable for children under 3 as they contains small parts. We always recommend adult supervision at all times and for children to be 5 years and over.",In stock
Little Eco Shop,Sow n Sow Enchanted Garden Gift of Seeds,11.00,https://littleecoshop.com.au/products/sow-n-sow-bug-enchanted-garden-gift-of-seeds,https://cdn.shopify.com/s/files/1/0031/7344/9797/products/Enchant_web.jpg?v=1601513973,Seed Kits,"Create an enchanted flower garden that will capture the imagination of the child in us all. This delightful mix of flower seeds attracts beautiful butterflies and bees and will brighten any pot or garden patch. A mix of dianthus, cosmos, cornflower and alyssum, all are easy to grow and are garden favourites for young and old. Simply scatter seeds, cover with a thin layer of soil and keep moist. These quick growing seeds will pop up in a few days and delight any nature lover. A gift and a card in one, this Gift of Seeds is embellished with stunning illustrations created by Daniella Germain and is printed with pink foiling which glistens in the sunshine. Each packet comes with a tear-away card plant label and sowing instructions are printed on the inside of the packet. TOP TIP: buy any 10 or more Sow n Sow Gift of Seed cards and receive 10% off. Discount is automatically applied at checkout. Why have we selected this product? Made from 100% recycled paper Stunning hand illustrated designs by Daniella Germain Kit includes 4 seed varieties (Cosmos sulphureus, Lobularia maritime, Dianthus barbatus, Centaurea cyanus) an illustrative, non-toxic plant label to mark where your seeds are planted and a recycled kraft envelope for mailing Promotes beautiful insects such as bees, butterflies and beneficial bugs Makes an excellent gift for nature lovers and budding green thumbs Product Stats: Material: 100% recycled paper Dimensions / weight: Made in: Australia **THIS PRODUCT CAN NOT BE SHIPPED TO WA DUE TO SEED/QUARANTINE RESTRICTIONS**",In stock
Little Eco Shop,Little Veggie Patch Beginners Seed Kit,30.00,https://littleecoshop.com.au/products/little-veggie-patch-beginners-seed-kit-1,https://cdn.shopify.com/s/files/1/0031/7344/9797/products/Seed_Kits_2.0_Beginners_Front_1024x1024_4540c9d2-2441-4f21-bb7a-94552ea44eb5.jpg?v=1600739199,Seed Kits,"New to growing your own food? Or have you attempted to before and it’s been a epic failure?! This beginners seed kit is as good as a given, growing with the support of our easy to follow instructions and top five easiest plants. Radish, silverbeet, parsley, spring onion and lettuce are simple to propagate from seed and suited to the smallest of spaces. Why have we selected this product? Seed kit includes Radish, Silverbeet, Parsley, Spring Onion and Lettuce seeds, planting instructions, biodegradable propagating pots and reusable plant labels Makes an excellent gift Adds colour to your garden and your plate! Product Stats: Material: cardboard tube box Dimensions / weight: 16cm L, 8.5cm diameter **THIS PRODUCT CAN NOT BE SHIPPED TO WA DUE TO SEED/QUARANTINE RESTRICTIONS**",In stock
Little Eco Shop,Little Veggie Patch Balcony Seed Kit,30.00,https://littleecoshop.com.au/products/little-veggie-patch-balcony-seed-kit,https://cdn.shopify.com/s/files/1/0031/7344/9797/products/Seed_Kits_2.0_Balcony_Front_1024x1024_6790ad72-6155-4e7f-a206-9a12eb13144b.jpg?v=1600738552,Seed Kits,"This balcony seed kit includes some of our favourite small space specialists, designed to be grown in pots in even the tightest of spaces. An perfectly curated mix of fruiting, leafing and flowering varieties, to help you hone your veggie patch skills for when you’re ready to upscale. Why have we selected this product? Seed kit includes Tomato (bush), Basil, Chilli, Spinach and Cornflower seeds, planting instructions, biodegradable propagating pots and reusable plant labels Makes an excellent gift Adds colour to your garden and your plate! Product Stats: Material: cardboard tube box Dimensions / weight: 16cm L, 8.5cm diameter **THIS PRODUCT CAN NOT BE SHIPPED TO WA DUE TO SEED/QUARANTINE RESTRICTIONS**",In stock
Little Eco Shop,Sow n Sow Wildflowers Gift of Seeds,11.00,https://littleecoshop.com.au/products/sow-n-sow-wildflowers-gift-of-seeds,https://cdn.shopify.com/s/files/1/0031/7344/9797/products/Wildflower_front_web.jpg?v=1599787275,Seed Kits,"Create memories and instill a joy of gardening with our vintage inspired ‘Wildflowers’ Gift of Seeds. Wildflowers is a greeting card containing a mix of three easy to grow seeds with Californian Poppy, Cosmos & Alyssum. This gift of seeds will enchant nature lovers and budding green thumbs young and old. Simply scatter seeds in the garden or into a pot with potting mix, lightly cover with soil, keep moist and wait for these quick growing seeds to pop up in a few days. TOP TIP: buy any 10 or more Sow n Sow Gift of Seed cards and receive 10% off. Discount is automatically applied at checkout. Why have we selected this product? Made from 100% recycled paper Stunning hand illustrated designs by Daniella Germain Space to write a message on the back of the card Kit includes 3 seed varieties ( Californian Poppy, Cosmos & Alyssum ) an illustrative, non-toxic plant label to mark where your seeds are planted and a recycled kraft envelope for mailing Makes an excellent gift for nature lovers and budding green thumbs Product Stats: Material: 100% recycled paper Dimensions / weight: Made in: Australia **THIS PRODUCT CAN NOT BE SHIPPED TO WA DUE TO SEED/QUARANTINE RESTRICTIONS**",In stock
Little Eco Shop,Eco Kitchen Cleaning Starter Kit - 6 items for 5% discount,22.52,https://littleecoshop.com.au/products/eco-kitchen-cleaning-starter-kit-6-items-for-5-discount-4,,Custom Bundle,Select any SIX products of your choice and receive a 5% discount Visit bundle page to edit the bundle,In stock
Little Eco Shop,Hello Snowglobe Reusable Fabric Gift Wrap - Save the Trees,19.00,https://littleecoshop.com.au/products/hello-snowglobe-reusable-fabric-gift-wrap-save-the-trees,https://cdn.shopify.com/s/files/1/0031/7344/9797/products/IMG_7012.jpg?v=1598590726,Wrapping,"Did you know? Every Christmas, Australians throw away over 350,000 km of wrapping paper! That’s equivalent of 50,000 trees! And that’s just Christmas alone. So why not consider a beautiful reusable alternative? Hello Snowglobe have designed these ingenious reusable fabric gift wraps to replace disposable wrapping paper. Not only do they look stunning, but they are designed to be used over and over so you can avoid paper wrapping and save some precious trees in the process. There are many ways to wrap your present using Hello Snowglobe fabrics. The Japanese style of wrapping with fabric is called Furoshiki and it is used to transport clothes, gifts or other goods. It is done by wrapping the object and tying knots and bows to secure it. It’s functional and looks great! Hello Snowglobe fabrics are designed to be used in this method or in a traditional present wrapping style with some string or ribbon to hold it in place. Why have we selected this product? Endlessly reusable Six beautiful fabrics to choose from Two sizes to choose from - Small size will fit items such as jewelry, books or candles; Large will fit an averaged sized shoe box Wraps have a removable ribbon which allows you to wrap your gift in many different ways Furoshiki inspired but with a modern twist Help reduce deforestation and waste Choose to gift the wrap to the recipient to reuse or keep for yourself to reuse Product Stats: Material: Cotton Dimensions / weight: Small 48 x 42cm or Large 62 x 53cm Made in:",In stock
Little Eco Shop,Hello Snowglobe Reusable Fabric Gift Wrap - Tea at Oma's,19.00,https://littleecoshop.com.au/products/hello-snowglobe-reusable-fabric-gift-wrap-tea-at-omas,https://cdn.shopify.com/s/files/1/0031/7344/9797/products/IMG_7222.jpg?v=1598589557,Wrapping,"Did you know? Every Christmas, Australians throw away over 350,000 km of wrapping paper! That’s equivalent of 50,000 trees! And that’s just Christmas alone. So why not consider a beautiful reusable alternative? Hello Snowglobe have designed these ingenious reusable fabric gift wraps to replace disposable wrapping paper. Not only do they look stunning, but they are designed to be used over and over so you can avoid paper wrapping and save some precious trees in the process. There are many ways to wrap your present using Hello Snowglobe fabrics. The Japanese style of wrapping with fabric is called Furoshiki and it is used to transport clothes, gifts or other goods. It is done by wrapping the object and tying knots and bows to secure it. It’s functional and looks great! Hello Snowglobe fabrics are designed to be used in this method or in a traditional present wrapping style with some string or ribbon to hold it in place. Why have we selected this product? Endlessly reusable Six beautiful fabrics to choose from Two sizes to choose from - Small size will fit items such as jewelry, books or candles; Large will fit an averaged sized shoe box Wraps have a removable ribbon which allows you to wrap your gift in many different ways Furoshiki inspired but with a modern twist Help reduce deforestation and waste Choose to gift the wrap to the recipient to reuse or keep for yourself to reuse Product Stats: Material: Cotton Dimensions / weight: Small 48 x 42cm or Large 62 x 53cm Made in:",Out of stock
Little Eco Shop,Hello Snowglobe Reusable Fabric Gift Wrap - Island Time,19.00,https://littleecoshop.com.au/products/hello-snowglobe-reusable-fabric-gift-wrap-island-time,https://cdn.shopify.com/s/files/1/0031/7344/9797/products/IMG_7225.jpg?v=1598589228,Wrapping,"Did you know? Every Christmas, Australians throw away over 350,000 km of wrapping paper! That’s equivalent of 50,000 trees! And that’s just Christmas alone. So why not consider a beautiful reusable alternative? Hello Snowglobe have designed these ingenious reusable fabric gift wraps to replace disposable wrapping paper. Not only do they look stunning, but they are designed to be used over and over so you can avoid paper wrapping and save some precious trees in the process. There are many ways to wrap your present using Hello Snowglobe fabrics. The Japanese style of wrapping with fabric is called Furoshiki and it is used to transport clothes, gifts or other goods. It is done by wrapping the object and tying knots and bows to secure it. It’s functional and looks great! Hello Snowglobe fabrics are designed to be used in this method or in a traditional present wrapping style with some string or ribbon to hold it in place. Why have we selected this product? Endlessly reusable Six beautiful fabrics to choose from Two sizes to choose from - Small size will fit items such as jewelry, books or candles; Large will fit an averaged sized shoe box Wraps have a removable ribbon which allows you to wrap your gift in many different ways Furoshiki inspired but with a modern twist Help reduce deforestation and waste Choose to gift the wrap to the recipient to reuse or keep for yourself to reuse Product Stats: Material: Cotton Dimensions / weight: Small 48 x 42cm or Large 62 x 53cm Made in:",Out of stock
Little Eco Shop,Hello Snowglobe Reusable Fabric Gift Wrap - Celebrate With Balloons,19.00,https://littleecoshop.com.au/products/hello-snowglobe-reusable-fabric-gift-wrap-celebrate-with-balloons,https://cdn.shopify.com/s/files/1/0031/7344/9797/products/Wrappingribbon.jpg?v=1598590470,Wrapping,"Did you know? Every Christmas, Australians throw away over 350,000 km of wrapping paper! That’s equivalent of 50,000 trees! And that’s just Christmas alone. So why not consider a beautiful reusable alternative? Hello Snowglobe have designed these ingenious reusable fabric gift wraps to replace disposable wrapping paper. Not only do they look stunning, but they are designed to be used over and over so you can avoid paper wrapping and save some precious trees in the process. There are many ways to wrap your present using Hello Snowglobe fabrics. The Japanese style of wrapping with fabric is called Furoshiki and it is used to transport clothes, gifts or other goods. It is done by wrapping the object and tying knots and bows to secure it. It’s functional and looks great! Hello Snowglobe fabrics are designed to be used in this method or in a traditional present wrapping style with some string or ribbon to hold it in place. Why have we selected this product? Endlessly reusable Six beautiful fabrics to choose from Two sizes to choose from - Small size will fit items such as jewelry, books or candles; Large will fit an averaged sized shoe box Wraps have a removable ribbon which allows you to wrap your gift in many different ways Furoshiki inspired but with a modern twist Help reduce deforestation and waste Choose to gift the wrap to the recipient to reuse or keep for yourself to reuse Product Stats: Material: Cotton Dimensions / weight: Small 48 x 42cm or Large 62 x 53cm Made in:",In stock
Little Eco Shop,Little Wildling Co Tea Infuser / Strainer,18.95,https://littleecoshop.com.au/products/tea-infuser-strainer,https://cdn.shopify.com/s/files/1/0031/7344/9797/products/20200826_103528.jpg?v=1598402610,Loose Tea Infusers,"Did you know many tea bags contain plastic and are therefore not recommended for composting? Not to mention the micro-particles of plastic that are inadvertently ingested when using tea bags. Swapping to loose tea is the best way to avoid unintentionally using tea bags that contain plastic. The added benefit of loose tea is that it tastes so much better! So why not grab yourself a loose tea infuser and sit back and relax with a perfect, waste-free tea. Why have we selected this product? Avoid plastic in tea bags by using loose tea leaves 100% plastic-free Reusable Fits perfectly into teacups and mugs Fine holes so tea leaves can't escape into your cup Use the lid as a saucer once your tea has finished brewing No more struggling to get loose tea leaves into the small ball infusers Product Stats: Material: stainless steel Dimensions / weight: 9.5 x 7.4 x 6.3 cm Made in: China",In stock
Little Eco Shop,Keep Leaf Reusable Sandwich Baggie - Stars - Large,13.95,https://littleecoshop.com.au/products/keep-leaf-reusable-sandwich-baggie-stars-large,https://cdn.shopify.com/s/files/1/0031/7344/9797/products/KLLS.jpg?v=1598260450,Sandwich Bags,"Keep Leaf reusable sandwich baggies offer an attractive alternative to disposable plastic sandwich bags, clingwrap, alfoil or plastic containers. These litterless lunch baggies are ideal for sandwiches, bagels, snacks or even sushi rolls. Why have we selected this product? 100% cotton exterior Waterproof liner to keep food fresh and to protect the exterior Easy Velcro closure BPA, lead and Phthalate free Reusable Product Stats: Material: 100% cotton exterior, waterproof liner Dimensions / weight: 18cm L x 16.5cm W",In stock
Little Eco Shop,Keep Leaf Food/Sandwich Wrap - Stars,14.95,https://littleecoshop.com.au/products/keep-leaf-food-sandwich-wrap-stars,https://cdn.shopify.com/s/files/1/0031/7344/9797/products/KLWS.jpg?v=1598261074,Sandwich Wraps,"Keep Leaf reusable food wraps offer an attractive alternative to disposable plastic sandwich bags, clingwrap, alfoil or plastic containers. These litterless lunch wraps are ideal for wrapping sandwiches, bagels, snacks or even sushi rolls and double up as a mat or plate so you can eat your lunch on the go without making a mess. Why have we selected this product? 100% cotton exterior Waterproof liner to keep food fresh and to protect the exterior Easy Velcro closure BPA, lead and Phthalate free Reusable Product Stats: Material: 100% cotton exterior, waterproof liner Dimensions / weight: 35.5cm diameter (when opened)",In stock
Little Eco Shop,Keep Leaf Reusable Sandwich Baggie - Stars - Small,12.95,https://littleecoshop.com.au/products/keep-leaf-reusable-sandwich-baggie-stars-small,https://cdn.shopify.com/s/files/1/0031/7344/9797/products/KLMS.jpg?v=1598260102,Sandwich Bags,"Keep Leaf reusable sandwich baggies offer an attractive alternative to disposable plastic sandwich bags, clingwrap, alfoil or plastic containers. These litterless lunch baggies are ideal for smaller snacks such as nuts, crackers, veggie sticks, fruit etc. Why have we selected this product? 100% cotton exterior Waterproof liner to keep food fresh and to protect the exterior Easy Velcro closure BPA, lead and Phthalate free Reusable Easy to clean: hand rinse, machine washable, dishwasher safe Product Stats: Material: 100% cotton exterior, waterproof liner Dimensions / weight: 18cm L x 11cm W",In stock
Little Eco Shop,Soka Australia - Multipurpose Laundry Soaking Tub,79.95,https://littleecoshop.com.au/products/soka-australia-multipurpose-laundry-soaking-tub,https://cdn.shopify.com/s/files/1/0031/7344/9797/products/Soka_tub.jpg?v=1597895339,Soap Nuts,"This innovatively designed multipurpose laundry soaking tub was designed by an Australian mum to make your life in the laundry room a whole lot easier all while being kinder to the environment. The tub contains three removable soaking compartments which are ideal for soaking items separately e.g. delicates vs brightly coloured items. If you’re a seasoned eco-warrior and have multiple reusable items in circulation then this tub is a lifesaver (think reusable unpaper towels in one compartment, menstrual pads in another compartment and cloth nappy inserts in another). The smaller compartments allow you to save water and detergent as you can soak one or two items separately rather than having to fill your large laundry sink. Grey water can then easily be emptied and recycled in your garden (if appropriate detergents have been used). But best of all, this ingenious product is made right here in Australia. Why have we selected this product? This innovative design is guaranteed to save time and your sanity Reduces your water and detergent consumption and allows for easy water recycling 8 piece unit (4 soaking buckets of differing sizes, 3 draining lids, 1 lid) Compact – all pieces fit neatly inside the main bucket Lid – provides discretion and keeps kids and pets out! The three inner compartments have removable draining lids – great for discretion and for easy recycling of water. The large drainer can also be used as a stirrer so you never have to get your hands wet Durable and stain resistant Stylish and minimalist appearance Space saving – sit your Soka in your laundry sink and still have space to run water and wash your hands in the sink Not only great for the laundry room – can be used to wash the car, wash windows, take camping, use as wine/drinks cooler, dry pail for cloth nappies, storage unit etc. Product Stats: Material: Durable BPA-free plastic Dimensions / weight: 30 cm W x 26 cm H x 26.5 cm D, 23 litres combined capacity Made in: Brisbane, Australia PLEASE NOTE: This product is drop-shipped directly from the Soka Australia warehouse in Brisbane so the price of the product includes postage of the Soka tub only. If you purchase other products from Little Eco Shop they will be shipped separately and may incur additional postage fees (however, shipping is free over $150).",In stock
Little Eco Shop,Sow n Sow Flower Press ‘Wattle’ Mini,55.00,https://littleecoshop.com.au/products/flower-press-wattle-mini,https://cdn.shopify.com/s/files/1/0031/7344/9797/products/WattlePress_top_web.jpg?v=1539081184,Flower Presses,"This gorgeous Wattle Mini Flower Press is hand crafted in Australia and features a beautiful illustration by Daniella Germain on the front. To press your blooms, simply pick from the garden and arrange them on the sheets of cardboard provided. Tighten the nuts, and leave the blooms to dry for 3-4 weeks. This is the perfect way to eternalise the beauty of your flowers and foliage. You can use your beautiful creations to create pieces of art, picture frames, gift cards or gift tags. This makes an excellent gift for both adults and children as it promotes creativity, sustainability and an understanding of biological processes. Why have we selected this product? Press includes engraved top and bottom backing boards (MDF), 5 x cardboard separating layers, bolts and wing nuts Hand made in Melbourne Hand illustrated by Daniella Germain Excellent gift idea for children and adults Promotes sustainability and interaction with nature Product Stats: Material: MDF Dimensions / weight: 14cm L x 12cm W x 4cm D Made in: Australia",In stock
Little Eco Shop,Cloth Nappy Trial Pack - $84.95,84.95,https://littleecoshop.com.au/products/cloth-nappy-trial-pack-79-96,https://cdn.shopify.com/s/files/1/0031/7344/9797/products/bundle_c950b49c-9b9f-4a5c-96a0-fa32493e75cd.jpeg?v=1615430616,Custom Bundle,Do not add this product to your cart. Please visit the bundle page to edit. This is a dummy product and must not be deleted or altered . Dummy products are essential for the Bundle Builder app to function. Learn more here: https://docs.bundlebuilder.app/reference/dummy-products,In stock
Little Eco Shop,ZeroCare Plastic-free Hair Scrunchies,15.95,https://littleecoshop.com.au/products/zerocare-hair-scrunchies,https://cdn.shopify.com/s/files/1/0031/7344/9797/products/Srunchies.jpg?v=1597810653,Bamboo Hairbrushes,"Now you can style your hair with these beautifully and ethically hand made hair scrunchies. They are made in Australia from sustainable fabrics such as hemp, bamboo, linen and organic cotton and proudly contain plastic-free elastics. Why have we selected this product? Made of sustainable fabrics such as hemp, bamboo, linen and organic organic cotton 100% plastic-free, including the elastic White/Beige come in a set of two (one of each colour) while Teal is available as a single scrunchie Strong hold Suitable for all hair types Product Stats: Material: hemp, bamboo, linen and organic organic cotton and plastic-free elastic Dimensions / weight: Made in: Australia PLEASE NOTE: fabrics may vary slightly from the ones pictured",In stock
Little Eco Shop,Pod Star Stainless Steel Coffee Scoop,12.95,https://littleecoshop.com.au/products/pod-star-stainless-steel-coffee-scoop,https://cdn.shopify.com/s/files/1/0031/7344/9797/products/Scoop.jpg?v=1597719206,Coffee Capsules,"This stainless steel coffee scoop is ideal for Pod Star’s Nespresso®, Aldi K-fee, Caffitaly, Espressotoria & Verismo refillable coffee pods. Simply scoop in the ground coffee and tamp down with the base of the scoop. Why have we selected this product? Ideal for Pod Star’s reusable capsules 100% Plastic-free Dual purpose – use as a scoop and a tamper Designed to last a lifetime Product Stats: Material: 304 stainless steel Dimensions / weight: 11cm L x 2.5cm W Made in: China",Out of stock
