site,title,price,url,image,categories,description,availability
Little Eco Shop,DownUnder Wash Co. Laundry Stain Remover,12.95,https://littleecoshop.com.au/products/hannahpad-laundry-stain-remover,https://cdn.shopify.com/s/files/1/0031/7344/9797/products/stain_remover_powder_DU.png?v=1648088703,Menstrual Pads,"Spray, sprinkle or soak with this Downunder Wash Co. laundry stain remover. Apply directly on the stain as a paste, via a diluted spray, or as a soaker to effectively remove stains. This stain remover is made from sodium sesquicarbonate which is a double of salt (sodium bicarbonate + sodium carbonate) commonly found in natural baby laundry products and bath salts. Each home compostable pouch contains only one active ingredient and no harsh chemical fillers to effectively remove stains from your reusable pads or undies whilst being gentle on the organic cotton fibres and the environment. Why have we selected this product? Can also be used on other clothing to remove most stains Alkaline pH 9.6 Use as a soaker or create a solution for use in a spray bottle Not tested on animals No surfactants, fragrance, optical brighteners or phosphates Packaged in 100% compostable pouch Product Stats: Material: Sodium Sesquicarbonate Dimensions / weight: 150g or 500g compostable pouch Made in: Packed in Australia from ingredients made in the UK",In stock
Little Eco Shop,Ever Eco Stackable Bento Box + Mini Container 1200ml,46.95,https://littleecoshop.com.au/products/ever-eco-stackable-bento-box-mini-container-1200ml,https://cdn.shopify.com/s/files/1/0031/7344/9797/products/small_bento_packaged_1500x1500_crop_center_8eb9cc0c-56aa-44eb-9b55-9d6817c8af66.jpg?v=1562543556,Stainless Steel Lunchboxes,"This Ever Eco stainless steel 2 tier stackable bento box offers the perfect amount of space for your lunch and a snack on the go. This plastic-free lunchbox is the perfect eco-friendly alternative ideal for all the family. Why have we selected this product? Two tiers plus mini snack container Premium 304 food grade stainless steel which won’t retain or impart flavours 1200ml total capacity (top layer 400ml, bottom layer 620ml, container 180ml) Top layer can be used on it's own as a separate container Handy adjustable side clips for easy and snug closure Dishwasher safe Durable Reusable and recyclable Plastic-free Free from BPA, PVC, Lead and Phthalates Product Stats: Material: 304 food grade stainless steel Dimensions / weight: 14.5 x 11 x 8cm Made in: India A message from the manufacturer: this bento box is not leakproof. We suggest pairing it with our leakproof Mini Containers or Nesting Containers for dips, sauces, salad dressing, yoghurt and juicy fruit.",In stock
Little Eco Shop,Keep Leaf Reusable Sandwich Baggie - Robots - Small,12.95,https://littleecoshop.com.au/products/keep-leaf-reusable-sandwich-baggie-robots-small,https://cdn.shopify.com/s/files/1/0031/7344/9797/products/web_BaggieMed_Robot-1.jpg?v=1560485228,Sandwich Bags,"Keep Leaf reusable sandwich baggies offer an attractive alternative to disposable plastic sandwich bags, clingwrap, alfoil or plastic containers. These litterless lunch baggies are ideal for smaller snacks such as nuts, crackers, veggie sticks, fruit etc. Why have we selected this product? 100% cotton exterior Waterproof liner to keep food fresh and to protect the exterior Easy Velcro closure BPA, lead and Phthalate free Reusable Easy to clean: hand rinse, machine washable, dishwasher safe Product Stats: Material: 100% cotton exterior, waterproof liner Dimensions / weight: 18cm L x 11cm W",In stock
Little Eco Shop,Keep Leaf Food/Sandwich Wrap - Planes,14.95,https://littleecoshop.com.au/products/keep-leaf-food-sandwich-wrap-black-white,https://cdn.shopify.com/s/files/1/0031/7344/9797/products/web_FoodWrap_Plane.jpg?v=1560484845,Sandwich Wraps,"Keep Leaf reusable food wraps offer an attractive alternative to disposable plastic sandwich bags, clingwrap, alfoil or plastic containers. These litterless lunch wraps are ideal for wrapping sandwiches, bagels, snacks or even sushi rolls and double up as a mat or plate so you can eat your lunch on the go without making a mess. Why have we selected this product? 100% cotton exterior Waterproof liner to keep food fresh and to protect the exterior Easy Velcro closure BPA, lead and Phthalate free Reusable Product Stats: Material: 100% cotton exterior, waterproof liner Dimensions / weight: 35.5cm diameter (when opened)",In stock
Little Eco Shop,EcoNaps,0.00,https://littleecoshop.com.au/products/econaps,,Custom Bundle,Visit bundle page to edit the bundle,In stock
Little Eco Shop,Ever Eco Reusable Silicone Food Covers - 6 pack,24.95,https://littleecoshop.com.au/products/ever-eco-reusable-silicone-food-covers-6-pack,https://cdn.shopify.com/s/files/1/0031/7344/9797/products/silicone-food-wraps-6-768x682.jpg?v=1557722028,Silicone Food Covers,"You really can say goodbye to cling wrap now! These innovative reusable silicone food covers are designed to stretch over dishes, bowls, cans, cups or even fruit and veggies to provide an airtight seal and prolong the life of your food. Why have we selected this product? Clear silicone so you can easily see inside Set includes 6 versatile sizes so you are always covered (pun intended)! Covers are circular in shape however will fit and seal a variety of shapes Can also be used to seal cut fruit and vegetables such as onion, lemon, capsicum, pineapple, melon, sweet potato etc. Reusable Top rack dishwasher safe Suitable for fridge, freezer and microwave Product Stats: Material: premium FDA-approved food grade silicone Dimensions / weight: 6 versatile sizes (6.5cm, 9.5cm, 11.5cm, 14.5cm, 16.5cm, 21cm) Made in: China",In stock
Little Eco Shop,Little Eco Shop Konjac Facial Sponge,8.95,https://littleecoshop.com.au/products/little-eco-shop-konjac-facial-sponge,https://cdn.shopify.com/s/files/1/0031/7344/9797/products/20190509-131323.jpg?v=1557371366,Facial cleansing,"The Konjac facial sponge is made from the powdered root of the Japanese Konnyoku plant. It is amazingly soft when wet and naturally PH balanced making it perfect for cleansing the delicate skin of the face. Simply wet to soften before use, and hang to dry between uses. Now also available with charcoal, pink clay and green clay infused. Charcoal infused konjac sponges are ideal for acne prone skin as the charcoal absorbs excess oil and also works at removing acne-causing bacteria from the skin. Pink clay konjac sponges are ideal for dull, dehydrated skin as the properties in pink clay are known to assist skin cell renewal. Green clay konjac sponges are ideal for those with oily or combination skin types as the green clay draws out excess oils and helps unclog pores. Natural konjac sponges are ideal for very sensitive skin. Why have we selected this product? Super soft and gentle on delicate skin Will gently cleanse, exfoliate and leave your skin glowing and soft Gentle enough to use every day Natural Lasts 2 - 3 months Compostable at end of life (when it starts to crumble) Available in 4 colours Product Stats: Material: root of the Japanese Konnyoku plant Dimensions / weight: 7.5cm x 4cm Made in: China",In stock
Little Eco Shop,Retro Kitchen Dish Cloth - Chooks,7.95,https://littleecoshop.com.au/products/retro-kitchen-dish-cloth-chooks,https://cdn.shopify.com/s/files/1/0031/7344/9797/products/chooks.jpg?v=1554779200,Dish Cloth,"These Retro Kitchen dish cloths feature unique and lighthearted designs making cleaning so much more fun! But best of all, they are plastic-free and are biodegradable and compostable at the end of their life meaning they can avoid going to landfill. Why have we selected this product? Come in a range of designs to suit all kitchens and personalities Biodegradable and compostable (just bury in your garden or put in composter at end of life) Plastic-free Machine washable Super absorbent With one slightly rough side and one smooth side they are ideal for washing dishes and for wiping surfaces Glide over surfaces easily leaving them streak-free Product Stats: Material: Cotton and cellulose Dimensions / weight:﻿ 20 cm x 18cm Made in: Sweden (designed in Australia)",In stock
Little Eco Shop,Retro Kitchen Dish Cloth - Cow,7.95,https://littleecoshop.com.au/products/retro-kitchen-dish-cloth-cow,https://cdn.shopify.com/s/files/1/0031/7344/9797/products/cow.jpg?v=1554779112,Dish Cloth,"These Retro Kitchen dish cloths feature unique and lighthearted designs making cleaning so much more fun! But best of all, they are plastic-free and are biodegradable and compostable at the end of their life meaning they can avoid going to landfill. Why have we selected this product? Come in a range of designs to suit all kitchens and personalities Biodegradable and compostable (just bury in your garden or put in composter at end of life) Plastic-free Machine washable Super absorbent With one slightly rough side and one smooth side they are ideal for washing dishes and for wiping surfaces Glide over surfaces easily leaving them streak-free Product Stats: Material: Cotton and cellulose Dimensions / weight:﻿ 20 cm x 18cm Made in: Sweden (designed in Australia)",In stock
Little Eco Shop,Retro Kitchen Dish Cloth - Duck,7.95,https://littleecoshop.com.au/products/retro-kitchen-dish-cloth-duck,https://cdn.shopify.com/s/files/1/0031/7344/9797/products/duck.jpg?v=1554779020,Dish Cloth,"These Retro Kitchen dish cloths feature unique and lighthearted designs making cleaning so much more fun! But best of all, they are plastic-free and are biodegradable and compostable at the end of their life meaning they can avoid going to landfill. Why have we selected this product? Come in a range of designs to suit all kitchens and personalities Biodegradable and compostable (just bury in your garden or put in composter at end of life) Plastic-free Machine washable Super absorbent With one slightly rough side and one smooth side they are ideal for washing dishes and for wiping surfaces Glide over surfaces easily leaving them streak-free Product Stats: Material: Cotton and cellulose Dimensions / weight:﻿ 20 cm x 18cm Made in: Sweden (designed in Australia)",In stock
Little Eco Shop,Retro Kitchen Dish Cloth - Sheep,7.95,https://littleecoshop.com.au/products/retro-kitchen-dish-cloth-sheep,https://cdn.shopify.com/s/files/1/0031/7344/9797/products/sheep.jpg?v=1554778935,Dish Cloth,"These Retro Kitchen dish cloths feature unique and lighthearted designs making cleaning so much more fun! But best of all, they are plastic-free and are biodegradable and compostable at the end of their life meaning they can avoid going to landfill. Why have we selected this product? Come in a range of designs to suit all kitchens and personalities Biodegradable and compostable (just bury in your garden or put in composter at end of life) Plastic-free Machine washable Super absorbent With one slightly rough side and one smooth side they are ideal for washing dishes and for wiping surfaces Glide over surfaces easily leaving them streak-free Product Stats: Material: Cotton and cellulose Dimensions / weight:﻿ 20 cm x 18cm Made in: Sweden (designed in Australia)",In stock
Little Eco Shop,Lil’ Bit Better – Bee Seed Bombs,7.95,https://littleecoshop.com.au/products/lil-bit-better-bee-seed-bombs,https://cdn.shopify.com/s/files/1/0031/7344/9797/products/Bee_Seed_Bombs.jpg?v=1570270614,Seed Kits,"Are you looking for a unique and mindful gift idea? These Bee Seed Bombs are the bees knees!! Choose from sets of three or six bee seed bombs, each presented beautifully in an unbleached muslin bag. These balls of organic matter have been impregnated with a collection of herb and flower seeds which will flower year after year and will encourage pollinators to your garden. Simply throw the ball into your garden (and water) wherever you’d like to add a bit of life and colour. Seed mix includes non-gmo, organic annual cottage flowers and herbs to be sown throughout spring and summer. These include: Calendula, Cornflower, Californian Poppy, Fineflower, Toadflax, Alyssum, Wallflower, Nemophila, Poppy, Marigold African, Chinese Forget-Me-Not, Borage, Evening Primrose, Lavender, Native Violet, Swan River Daisy, Sage, and Bee Balm. Why have we selected this product? Unique and mindful gift for loved ones Organic Plastic-free Contains a mix of herbs and flowers Promotes pollinating insects to your garden Product Stats: Material: Unbleached muslin bag containing seeds in organic matter Dimensions / weight: 3 or 6 seed bombs Made in: Australia Notes: Bee patient - some of these plants may not bloom the first year, but will reward you with more blooms in subsequent years! Australian natives are not suited to these bombs as many require specific germination conditions and many of our nectar rich species are shrubs or trees.",In stock
Little Eco Shop,Eco Kitchen Cleaning Starter Kit - 6 items for 5% discount,22.52,https://littleecoshop.com.au/products/eco-kitchen-starter-kit-5-items-for-5-discount,https://cdn.shopify.com/s/files/1/0031/7344/9797/products/cleaning2.jpg?v=1553230560,Custom Bundle,Select any SIX products of your choice and receive a 5% discount Visit bundle page to edit the bundle,In stock
Little Eco Shop,Wilfred Eco - Silicone Straws & Cocktail Straws (Single),3.95,https://littleecoshop.com.au/products/wilfred-eco-silicone-straws-single,https://cdn.shopify.com/s/files/1/0031/7344/9797/products/Screenshot-20200206-115907-Instagram.jpg?v=1580953907,Straws & Accessories,"If stainless steel or bamboo straws are not your thing then these beautiful silicone straws will definitely appeal to you. These soft and flexible straws provide a safer option for toddlers and young children or for those with sensory issues or special needs. Mini cocktail straws are now also available. Perfect for small cups for the small people in your life....or for your favourite cocktail! Top Tip: Take a look at our straw cleaners to complete your set Why have we selected this product? Plastic-free straws BPA free Perfect for all drink types including smoothies, juices and iced drinks or warm drinks Bent for easy drinking OR Straight mini cocktail straws for smaller cups/glasses Dishwasher safe Durable and reusable Safe for young children (supervision is always recommended) Easy to clean - simply use a straw cleaning brush and warm soapy water or put in dishwasher Won't clang against your teeth Can be resized with a sharp knife or scissors Four colours to choose from in the bendy straw, or two colours in the mini straight straw Great alternative for straw biters or those with sensory issues or special needs Sold separately Product Stats: Material: Silicone Dimensions / weight: Bendy straw = 20.0cm L, 10mm (approx) diameter. Mini straw =13.5cm L, 7mm diameter Made in: China *** Please note straws sold individually ***",In stock
Little Eco Shop,Eco Lunch Starter Kit - 5 items for 10% discount,8.78,https://littleecoshop.com.au/products/eco-lunch-starter-kit,https://cdn.shopify.com/s/files/1/0031/7344/9797/products/bundle_5ad4c33a-e2b9-4165-9d34-cba85d4cb32e.jpeg?v=1540699863,Custom Bundle,Add any FIVE products to receive a 10% DISCOUNT Visit bundle page to edit the bundle,In stock
Little Eco Shop,Eco Essentials Starter Kit - 5 items for 10% discount,8.78,https://littleecoshop.com.au/products/eco-work-starter-kit,https://cdn.shopify.com/s/files/1/0031/7344/9797/products/Bundle_cover.jpg?v=1623643236,Custom Bundle,Add any FIVE products to receive a 10% DISCOUNT Visit bundle page to edit the bundle,In stock
Little Eco Shop,Eco Shopping Starter Kit - 3 items for 10% discount,0.00,https://littleecoshop.com.au/products/eco-shopping-starter-kit,https://cdn.shopify.com/s/files/1/0031/7344/9797/products/bundle.jpeg?v=1540424616,Custom Bundle,Do not add this product to your cart. Please visit the bundle page to edit. This is a dummy product and must not be deleted or altered . Dummy products are essential for the Bundle Builder app to function. Learn more here: https://support.weareeight.com/hc/en-us/articles/360020184698-Dummy-Products,In stock
Little Eco Shop,Cheeki Insulated Tumbler - 500ml - Dusty Pink,34.95,https://littleecoshop.com.au/products/cheeki-insulated-tumbler-500ml-dusty-pink,https://cdn.shopify.com/s/files/1/0031/7344/9797/products/hkfcjDDY.png?v=1575690947,Tumblers,"This Cheeki insulated, stainless steel tumbler is the perfect reusable cup to help you minimise your waste and your environmental impact without having to give up your favourite fresh juice, smoothie, shake or iced tea or coffee. Why have we selected this product? Stainless steel straw included (with a mid-section bump to it can’t fall out) Stays cold for up to 6 hours Vacuum insulation means reduced condensation 18/8 food grade stainless steel therefore rust resistant and odourless Dishwasher friendly lid Fits in car cup holder No inside lining BPA free and toxic-free paint (on exterior) Comes with a Cheeki lifetime warranty 100% recyclable at end of its life Product Stats: Material: 18/8 Stainless steel Dimensions / weight: 500ml or 27oz / 18cm H (24cm H including straw) Made in: China",Out of stock
Little Eco Shop,Cheeki Insulated Tumbler - 500ml - Pistachio,34.95,https://littleecoshop.com.au/products/cheeki-insulated-tumbler-500ml-pistachio,https://cdn.shopify.com/s/files/1/0031/7344/9797/products/ZNqxlJV8_1.png?v=1580529554,Tumblers,"This Cheeki insulated, stainless steel tumbler is the perfect reusable cup to help you minimise your waste and your environmental impact without having to give up your favourite fresh juice, smoothie, shake or iced tea or coffee. Why have we selected this product? Stainless steel straw included (with a mid-section bump to it can’t fall out) Stays cold for up to 6 hours Vacuum insulation means reduced condensation 18/8 food grade stainless steel therefore rust resistant and odourless Dishwasher friendly lid Fits in car cup holder No inside lining BPA free and toxic-free paint (on exterior) Comes with a Cheeki lifetime warranty 100% recyclable at end of its life Product Stats: Material: 18/8 Stainless steel Dimensions / weight: 500ml or 27oz / 18cm H (24cm H including straw) Made in: China",Out of stock
Little Eco Shop,Cheeki Insulated Tumbler - 500ml - Ocean,34.95,https://littleecoshop.com.au/products/cheeki-insulated-tumbler-500ml-ocean,https://cdn.shopify.com/s/files/1/0031/7344/9797/products/FdUcdFcQ_1.png?v=1566100363,Tumblers,"This Cheeki insulated, stainless steel tumbler is the perfect reusable cup to help you minimise your waste and your environmental impact without having to give up your favourite fresh juice, smoothie, shake or iced tea or coffee. Why have we selected this product? Stainless steel straw included (with a mid-section bump to it can’t fall out) Stays cold for up to 6 hours Vacuum insulation means reduced condensation 18/8 food grade stainless steel therefore rust resistant and odourless Dishwasher friendly lid Fits in car cup holder No inside lining BPA free and toxic-free paint (on exterior) Comes with a Cheeki lifetime warranty 100% recyclable at end of its life Product Stats: Material: 18/8 Stainless steel Dimensions / weight: 500ml or 27oz / 18cm H (24cm H including straw) Made in: China",In stock
Little Eco Shop,Cheeki Insulated Active Drink Bottle - 600ml - Matte Black,44.95,https://littleecoshop.com.au/products/cheeki-insulated-active-drink-bottle-600ml-matte-black,https://cdn.shopify.com/s/files/1/0031/7344/9797/products/active_black.jpg?v=1553135323,Drink Bottle,"This Cheeki reusable drink bottle offers fast hydration when needed the most during sports or exercise. It’s a stylish and durable alternative to throw-away plastic water bottles and is better for the environment. It offers vacuum insulation meaning it’ll stay cold for 36 hours, even if left in the sun on the side of the pitch! This active bottle comes with a tri-tech sports lid with an adjustable flow dial which is 100% leak proof when switched to off. Why have we selected this product? Stays cold for up to 36 hours and stays hot for up to 24 hours Vacuum insulation means reduced condensation 18/8 stainless steel therefore rust resistant and odourless Leak proof OFF setting Four adjustable flow settings (high, medium, low and off) Fits in car cup holder Rubber base for soft landings! Secure dust cap BPA free and toxic-free paint Comes with a Cheeki lifetime warranty Product Stats: Material: 18/8 Stainless steel Dimensions / weight: 600ml / 27cm H (including lid) x 7.5cm W Made in: China",In stock
Little Eco Shop,EcoNaps Bamboo Tri-fold Night Booster kit (4 pack),54.95,https://littleecoshop.com.au/products/econaps-bamboo-tri-fold-night-booster-kit-4-pack,https://cdn.shopify.com/s/files/1/0031/7344/9797/products/hourglass_070bd8d6-2eee-492d-89b4-6d86289fbfc3.jpg?v=1550711073,Cloth Nappies,"Designed to help your little one sleeping all night long, our slim fitting and super absorbent bamboo tri-fold night boosters are a perfect addition to your cloth nappy kit. Made from silky bamboo and organic cotton, the extra thick 2x layer insert folds into thirds to offer an impressive 6x layers of extra absorption! Let these bad boys handle the night shift so you can catch a few extra zzz’s. Why have we selected this product? Includes 4 tri-fold bamboo night boosters Compatible with most other All-in-2 or Pocket Modern Cloth Nappies Come packaged in a gorgeous natural printed cotton bag Made of natural bamboo fiber for supreme absorbency Machine washable and quick drying when unfolded Each booster has 2x layers that when folded into thirds offers 6x extra layers of protection Adjustable fold can be tailored to suit tummy sleepers & boys Product Stats Material: earth-friendly bamboo & organic cotton fleece Made in: China Top Tip: Need some extra cloth nappy absorption, but not sure which bamboo booster size is best? Take a look at our mixed bamboo booster kits and our bamboo tri-fold night booster kits for more absorbency options.",In stock
Little Eco Shop,EcoNaps Mixed Bamboo Booster kit (6 pack),54.95,https://littleecoshop.com.au/products/econaps-mixed-bamboo-booster-kit-6-pack,https://cdn.shopify.com/s/files/1/0031/7344/9797/products/hourglass_eaad5f82-8c0c-4ffe-a3e8-b98d16e5b328.jpg?v=1550710407,Cloth Nappies,"Made from soft bamboo and organic cotton, our bamboo boosters are naturally thirsty to offer that extra layer of protection for bubs. The sleek design fits seamlessly with your EcoNaps modern cloth nappies without adding extra bulk. Simply layer the bamboo booster under your existing cloth nappy combination and fit to bubs as usual. It’s a little booster that holds a lot! They help make each wear last longer and are particularly useful if you have a heavy wetter or want to make it through the night with one less nappy change. Are you in? Why have we selected this product? Includes 4 x hourglass bamboo boosters and 2 x tri-fold night boosters Compatible with most other All-in-2 or Pocket Modern Cloth Nappies Come packaged in a gorgeous natural printed cotton bag Made of natural bamboo fiber for supreme absorbency Hourglass boosters are tapered at each end for maximum protection Machine washable Product Stats Material: earth-friendly bamboo & organic cotton fleece Made in: China",In stock
Little Eco Shop,EcoNaps Hourglass Bamboo Booster kit (6 pack),44.95,https://littleecoshop.com.au/products/econaps-hourglass-bamboo-booster-kit-6-pack,https://cdn.shopify.com/s/files/1/0031/7344/9797/products/hourglass.jpg?v=1550710209,Cloth Nappies,"Made from soft bamboo and organic cotton, our hourglass bamboo boosters are super absorbent to offer that extra layer of protection when you need it. The sleek design fits seamlessly with most modern cloth nappy styles. Simply layer the bamboo booster under your existing cloth nappy insert combination and fit to bubs as usual. They’re especially great if you have a heavy wetter on your hands or simply need some extra peace of mind at night time. And who doesn’t want that? Why have we selected this product? Includes 6 hourglass bamboo boosters Compatible with most other All-in-2 or Pocket Modern Cloth Nappies Come packaged in a gorgeous natural printed cotton bag Made of natural bamboo fiber for supreme absorbency Tapered at each end for maximum protection Machine washable Product Stats Material: earth-friendly bamboo & organic cotton fleece Made in: China Top Tip: Need some extra cloth nappy absorption, but not sure which bamboo booster size is best? Take a look at our mixed bamboo booster kits and our bamboo tri-fold night booster kits for more absorbency options.",In stock
Little Eco Shop,EcoNaps Convertible Bamboo Insert kit (4 Sets),59.95,https://littleecoshop.com.au/products/convertible-bamboo-insert-kit-4-sets,https://cdn.shopify.com/s/files/1/0031/7344/9797/products/Insertkit_1024x1024_a44d4488-de58-4aee-be93-68929cf9556d.jpg?v=1544004732,Cloth Nappies,"Are you thinking of adding some additional inserts to your stash of Modern Cloth Nappies? Then you've come to the right place! Each bamboo insert set includes two convertible bamboo inserts, giving up to 5 different absorption combinations, and are made from super soft, highly absorbent trim fitting bamboo. Why have we selected this product? Includes 4 full convertible insert sets Compatible with most other All-in-2 or Pocket Modern Cloth Nappies Come packaged in a gorgeous natural printed cotton bag Made of natural bamboo fiber for supreme absorbency Product Stats Material: Bamboo fiber Made in: China",Out of stock
